,Unnamed: 0,model,content,score,creationTime,nickname,productColor,productSales,productSize,userClientShow,userLevelName
17787,17787,HUAWEI nova 2 Plus,本来一直很喜欢华为，但这款手机实在让我很讨厌，有时候卡的要命，像素连几百块钱的手机都不如，真怀疑自己买了个假货，不建议大家买这款，后悔，准备用两月丢了，省的看到心烦,1,2017-12-04 10:00:39,j***d,草木绿,nova 2 plus 128GB,普通版,来自京东Android客户端,金牌会员
17788,17788,HUAWEI nova 2 Plus,再也不在京东上买华为手机了，质量很差，屏幕碰下就碎了，也不给换,1,2017-12-03 14:29:56,jd_周198012,流光金,nova 2,普通版,来自京东Android客户端,金牌会员
17789,17789,HUAWEI nova 2 Plus,最失败的一次购物 手机屏幕一点都不清晰,1,2017-12-02 22:49:42,y***8,流光金,nova 2 plus 64GB,普通版,来自京东Android客户端,银牌会员
17790,17790,HUAWEI nova 2 Plus,早上买的，下午就掉价&hellip;&hellip;京东自营也坑人，大家在京东买东西特别买华为要考虑下，特会欺骗消费者,1,2017-12-02 19:50:22,jd_139777uvq,玫瑰金,nova 2,普通版,来自京东Android客户端,钻石会员
17791,17791,HUAWEI nova 2 Plus,一般，视屏不太清楚，有点卡机，两千多不建议买这种,1,2017-12-02 14:53:59,j***.,玫瑰金,nova 2 plus 128GB,普通版,来自京东iPhone客户端,PLUS会员
17792,17792,HUAWEI nova 2 Plus,特意用了几天再来评价，手机上网有点卡，玩游戏也卡，第一次在京东买手机就搞都很不爽,1,2017-12-02 14:02:58,VTntGDKeDODZ,亮黑色,nova 2 plus 128GB,普通版,来自京东Android客户端,银牌会员
17793,17793,HUAWEI nova 2 Plus,伤心，买了12天就降价200元，觉得一点也保值,1,2017-12-02 10:19:18,孟***7,玫瑰金,nova 2,普通版,来自京东Android客户端,银牌会员
17794,17794,HUAWEI nova 2 Plus,机子是好机子，但是是翻新机，因为我下了工商银行的客户端登录不上，因为有一个账号，不是本人的,1,2017-11-30 15:54:27,贰***下,玫瑰金,nova 2,普通版,来自京东Android客户端,银牌会员
17795,17795,HUAWEI nova 2 Plus,一星也不想给，说了双十一降价补差价，结果一种种原因不给反，这么大的商城也不诚信，悲哀！！！！,1,2017-11-29 18:57:58,j***z,玫瑰金,nova 2,普通版,来自京东Android客户端,银牌会员
17796,17796,HUAWEI nova 2 Plus,我不知道我吐槽事实会不会店家背后删除。首先这款手机真的很一般。运行腾讯企鹅经常会卡顿，*经常加载不出来图片，而且我手机里面也只安装了一个微信一个腾讯企鹅一个*一个听歌软件。然后我买完不几天发现自己头大了，一个手机差价五六百，而且我买了两个。希望广大消费者引以为戒，不要当这个冤大TOU。。而且京东为了防止差评，特意设置了敏感词屏蔽，把可能差评的字都变成星号了。所以一些词我不得不用拼音和谐音组合。,1,2017-11-28 22:20:40,呵***2,玫瑰金,nova 2,普通版,来自京东Android客户端,金牌会员
17797,17797,HUAWEI nova 2 Plus,一直用小米的，手机天天在家给宝宝摔，屏幕从来都没出现过问题，这款手机买来不到二十天，根本舍不得给宝宝碰，晚上蹲下从口袋掉出来，屏幕立刻碎掉，心都碎了，这质量我也服了,1,2017-11-28 19:48:02,茶***1,玫瑰金,nova 2 plus 128GB,普通版,来自京东Android客户端,金牌会员
17798,17798,HUAWEI nova 2 Plus,手机摄像头潮湿，烘干指纹功能没有了，要修好，换主板，真厉害了。25天手机报废。,1,2017-11-28 17:41:44,章***长,曜石黑,nova 2 plus 128GB,普通版,来自京东Android客户端,PLUS会员
17799,17799,HUAWEI nova 2 Plus,手机本应该第二天就到了，结果京东配送错误，导致延误三天，打电话给客服，态度不好，一直转接，没人处理问题，每一个人回答的问题都不一样，很失望,1,2017-11-28 00:46:11,j***3,玫瑰金,nova 2,普通版,来自京东iPhone客户端,金牌会员
17800,17800,HUAWEI nova 2 Plus,手机好像是问题机翻新的，手机没有有下载任何东西，优酷里居然缓冲的电视剧，这是咋个回事？,1,2017-11-27 19:30:52,j***j,玫瑰金,nova 2,普通版,来自京东Android客户端,金牌会员
17801,17801,HUAWEI nova 2 Plus,之前一直用的华为手机，感觉不错，可是这次买的Nova2经常卡，反应慢，不知道是不是正品，好坑,1,2017-11-27 13:23:05,2***花,玫瑰金,nova 2,普通版,来自京东Android客户端,银牌会员
17802,17802,HUAWEI nova 2 Plus,我觉得我收到的是次品，收到货两天，老婆蹲地上弯腰去抱小孩，从二十公分高的地方掉地上就碎了屏幕，后经仔细检测发现摄像头镜片也是碎的（并不知道是本来就破的还是摔破的，我觉得不可能摔破的，因为和屏幕碎的角正好在相反的位置）。过了一天申请售后，由于老家没有京东直达，所以老早帮我签收了，申请售后已经离签收过了五天，我看页面售后退换都是七天，结果客服给我说只能签收后24小时，没办法我只能转维修，一修五百块连摄像头镜片都没修好就换一屏幕，我能说啥呢？几百块钱我不想浪费时间，只在这评论给大家一个参考。,1,2017-11-26 21:02:46,j***2,玫瑰金,nova 2 plus 64GB,普通版,来自京东Android客户端,银牌会员
17803,17803,HUAWEI nova 2 Plus,快递员随便把快递给别人，要是别人不给我怎么办？,1,2017-11-26 12:11:51,j***3,玫瑰金,nova 2,普通版,来自京东Android客户端,金牌会员
17804,17804,HUAWEI nova 2 Plus,差评,1,2017-11-25 15:50:52,大***结,玫瑰金,nova 2,普通版,来自京东iPhone客户端,金牌会员
17805,17805,HUAWEI nova 2 Plus,差评，已经坏了，质量很不好，谁买谁后悔。。,1,2017-11-25 09:20:57,j***v,草木绿,nova 2 plus 128GB,普通版,来自京东Android客户端,银牌会员
17806,17806,HUAWEI nova 2 Plus,发货速度太慢了,1,2017-11-24 18:12:59,e***u,玫瑰金,nova 2 plus 64GB,普通版,来自京东iPhone客户端,PLUS会员
17807,17807,HUAWEI nova 2 Plus,2499不到一个星期，2199，这牛比啊！,1,2017-11-23 20:58:34,j***0,极光蓝,nova 2,普通版,来自京东iPhone客户端,PLUS会员
17808,17808,HUAWEI nova 2 Plus,质量怎么那么差，手机怎么又杂音？？？？,1,2017-11-22 21:38:49,j***8,曜石黑,nova 2,普通版,来自京东iPhone客户端,金牌会员
17809,17809,HUAWEI nova 2 Plus,"真的是生气了，本来想支持国产的，还买了个比较贵的手机。就是怕它用不久，结果用不到一个月情况百出，卡到死，网络没有不好，买了46g,除了手机自带的，我就下载了那么几个常用的软件，卡到死！生气了还不能说脏话",1,2017-11-22 15:01:45,假***1,玫瑰金,nova 2 plus 64GB,普通版,来自京东Android客户端,银牌会员
17810,17810,HUAWEI nova 2 Plus,玩一小时阴阳师手机就发烫的不行，我用了三年华为g7也没有这么烫，并且手机电池玩游戏电量下得贼快，不推荐购买！太烫了这手机。,1,2017-11-22 01:22:42,j***9,曜石黑,nova 2,移动4G+版,来自京东Android客户端,金牌会员
17811,17811,HUAWEI nova 2 Plus,骗人的,1,2017-11-20 12:36:19,j***u,玫瑰金,nova 2 plus 64GB,普通版,来自京东iPhone客户端,金牌会员
17812,17812,HUAWEI nova 2 Plus,一个意想不到的惊喜,1,2017-11-20 01:53:39,老***9,玫瑰金,nova 2 plus 128GB,普通版,来自微信购物,金牌会员
17813,17813,HUAWEI nova 2 Plus,对华为真的超级失望，就这拍照质量也好意思大势吹嘘，之前我买的其他一千块手机比这个好多了，真的不是刻意黑它，良心评价，真想问问能不能退，我不想要了，本来就是想换个新手机给宝宝拍照的，每次拍完就感觉照片糊 ，你看用的最大像素拍出来一拉就糊成什么样子，真的像网上说的颗粒状严重，我后面准备投诉了,1,2017-11-19 18:42:24,j***2,玫瑰金,nova 2 plus 64GB,普通版,来自京东Android客户端,PLUS会员
17814,17814,HUAWEI nova 2 Plus,手机真烂，用了一天卡的比用了一年的手机一样，一直用华为的手机，这次真的很失望，要是能退货就好了，电池也不耐用,1,2017-11-18 23:16:57,j***6,草木绿,nova 2,普通版,来自京东Android客户端,银牌会员
17815,17815,HUAWEI nova 2 Plus,什么都不想说，手机买了四天才到，一直信赖的京东太失望了,1,2017-11-17 22:12:11,1***p,曜石黑,nova 2,普通版,来自京东Android客户端,钻石会员
17816,17816,HUAWEI nova 2 Plus,"双十一买的十五号到的货，十七号就屏碎了，小孩不小心一次掉地上了，屏就碎了，从来没有遇到这么差的手机，也太脆弱了吧，客服还跟我说是玻璃，你做手机不能这么没保障吧，本来很看中华为的，跟爸爸买了一款几百块钱的，特别好用，这款让人太失望了，
像豆腐一样，一颗星都不想给！",1,2017-11-17 12:24:20,爱***r,玫瑰金,nova 2,普通版,来自京东Android客户端,金牌会员
17817,17817,HUAWEI nova 2 Plus,不满意，物流用了两天，,1,2017-11-17 11:27:15,j***v,曜石黑,nova 2,普通版,来自微信购物,铜牌会员
17818,17818,HUAWEI nova 2 Plus,我一直很相信京东，但这次，我很失望，拍摄效果和我之前用的手机效果一样差不说，就在刚刚它的屏幕出现了花点现象，我无法理解，选择退货吧,1,2017-11-17 09:46:13,j***b,玫瑰金,nova 2 plus 128GB,普通版,来自微信购物,银牌会员
17819,17819,HUAWEI nova 2 Plus,买来一个礼拜内就卡，没怎么在意。后面越用越卡、还会黑屏、有的时候还会点不动。这才买了不到一个月，真心想问是不是买到了假货,1,2017-11-18 19:54:38,jd_132777jvr,玫瑰金,nova 2 plus 128GB,普通版,,银牌会员
17820,17820,HUAWEI nova 2 Plus,评论说屏幕很容易碎，想买碎屏保，上午还显示可以买碎屏保，但是没有收到货，我不确定你们发过来的是不是完好的手机，有没有问题，想等下午到货了再确认，手机没问题在购买碎屏保。询问客服，说不知道补购的时限，下午货到了，结果说买不了了。想请问一下，我没有看到手机是完好的，我凭什么放心给它买保险，我买车难道是先买保险，再买车？,1,2017-11-18 16:57:55,奋斗的胖头hoq,曜石黑,nova 2 plus 64GB,普通版,,银牌会员
17821,17821,HUAWEI nova 2 Plus,差评，说好的给赠品还有自拍杆一个都没给，打客服，也在推脱。没有赠品，你写在上面干什么？愤怒?,1,2017-11-18 15:56:55,j***k,玫瑰金,nova 2,普通版,来自京东iPhone客户端,PLUS会员
17822,17822,HUAWEI nova 2 Plus,差差差，刚买就降价300,1,2017-11-18 13:22:49,j***n,曜石黑,nova 2,普通版,来自京东Android客户端,钻石会员
17823,17823,HUAWEI nova 2 Plus,真的恼火，卡针都不送，数据迁移体验也是差的要死，完全搞不懂，难怪华为会被oppo和vivo超越那么多！一步一步作死的节奏！,1,2017-11-16 23:24:58,y***5,玫瑰金,nova 2 plus 64GB,普通版,来自微信购物,金牌会员
17824,17824,HUAWEI nova 2 Plus,太次了,1,2017-11-16 22:28:47,j***6,曜石黑,nova 2 plus 128GB,移动4G+版,来自京东Android客户端,银牌会员
17825,17825,HUAWEI nova 2 Plus,64G买回来就只剩40G左右的内存！运行内存只有2G左右，唉！看着办吧，老铁～,1,2017-11-16 19:53:08,j***a,草木绿,nova 2,普通版,来自京东Android客户端,银牌会员
17826,17826,HUAWEI nova 2 Plus,双十一降价 说可以补差价    现在问差价 说不可以了。  真心差差。,1,2017-11-16 15:49:26,j***c,草木绿,nova 2 plus 128GB,普通版,来自京东iPhone客户端,金牌会员
17827,17827,HUAWEI nova 2 Plus,"11日晚下的单购买的HUAWEI nova 2 Plus手机，昨天15日快递才电话通知送货，但是直到15日晚上23点货品没有送达收货人我，联系快递，发现货品在配送过程中丢失找不到了，怎么办?闹心啊！！！
15日晚和今天16日早上联系客服，也没有给回复，晕啊！咋办呢？",1,2017-11-16 10:07:53,d***8,曜石黑,nova 2 plus 128GB,普通版,,银牌会员
17828,17828,HUAWEI nova 2 Plus,这星是取消不了的，不想多说了,1,2017-11-15 21:49:50,随***9,流光金,nova 2,普通版,来自京东Android客户端,金牌会员
17829,17829,HUAWEI nova 2 Plus,物流太慢,1,2017-11-15 19:20:31,j***f,玫瑰金,nova 2 plus 64GB,普通版,来自京东Android客户端,银牌会员
17830,17830,HUAWEI nova 2 Plus,"查看相册的时候经常卡顿！划不了下一张，或者卡在中间～
?这不是我爱的华为了",1,2017-11-15 17:52:33,j***b,曜石黑,nova 2,普通版,来自京东Android客户端,银牌会员
17831,17831,HUAWEI nova 2 Plus,我早上买的手机  下午就降价了  还不给补差价  以后不会再买了,1,2017-11-15 17:48:52,j***a,玫瑰金,nova 2,普通版,来自京东iPhone客户端,铜牌会员
17832,17832,HUAWEI nova 2 Plus,差 刚买没几天舅出问题  这相机醉了,1,2017-11-15 15:45:57,j***b,极光蓝,nova 2,普通版,来自微信购物,铜牌会员
17833,17833,HUAWEI nova 2 Plus,才买这么多天，就开始卡的死机了，也是无语,1,2017-11-14 13:38:45,j***d,玫瑰金,nova 2 plus 128GB,普通版,来自京东Android客户端,银牌会员
17834,17834,HUAWEI nova 2 Plus,差评差评差评，要不是0颗星提交不了，一颗星都不想给，双十一活动领券买的，12号刚发货就降价，联系客户半天回复一句，竟说些没用的话，报价系统也无用，网购这么多年，头一次觉得京东这么恶心人。。,1,2017-11-14 09:29:12,j***a,玫瑰金,nova 2 plus 64GB,普通版,,金牌会员
17835,17835,HUAWEI nova 2 Plus,双十一搞活动，骗人的，写着有赠品就是幌子，只发来了手机，没有自拍杆，找客服，客服让找京东，找京东京东让找人工，，真是，网购的弊端,1,2017-11-14 06:30:25,D***v,玫瑰金,nova 2,普通版,来自微信购物,银牌会员
17836,17836,HUAWEI nova 2 Plus,服务实在太差，出现问题客服只会说抱歉，不但没有按时送货，因家里就一个人带孩子，没有办法下楼取件，让送货的送到楼上来，却被拒绝，京东不是都送货上门吗，我这有特殊情况要求送上门还被拒绝，实在让人气愤，客服只会说希望理解，难道我们消费者就不该被理解？,1,2017-11-13 22:32:15,j***c,流光金,nova 2,普通版,来自京东Android客户端,金牌会员
17837,17837,HUAWEI nova 2 Plus,手机还可以，服务绝对差评,1,2017-11-13 22:25:28,j***c,玫瑰金,nova 2,普通版,来自京东Android客户端,金牌会员
17838,17838,HUAWEI nova 2 Plus,手机勒话还可以的，但是说好的自拍杆也没有送，问客服，客服还一直用话搪塞我，明显勒敷衍了事，一点诚信都没有，太让人气愤了,1,2017-11-13 21:18:13,j***u,草木绿,nova 2,普通版,来自京东Android客户端,银牌会员
17839,17839,HUAWEI nova 2 Plus,说买贵退差价，结果知道买贵申请说什么赠品价格还得算，一根破烂的自拍杆一百块，我说我不要自拍杆和我退钱，就没声了，真黑京东,1,2017-11-13 20:51:11,多***柔,玫瑰金,nova 2 plus 64GB,普通版,来自京东Android客户端,PLUS会员
17840,17840,HUAWEI nova 2 Plus,手机是想买的，本来准备双十一买的，但店家太坑，买的时候明确表示双十一不降价，所以就提前买了，双十一看了下降价180，打客服电话申请价保的那一刻显示无货导致申请不了，真闹心，只能说京东自营店也不靠谱，欺骗消费者,1,2017-11-13 20:10:48,j***q,极光蓝,nova 2 plus 64GB,普通版,来自京东Android客户端,银牌会员
17841,17841,HUAWEI nova 2 Plus,刚买就降价二百，给退了，然后又降价五十，一个男客服给打电话说还能价保，结果我给打过去一个女的客服接待的，态度特别不好，根本不会弄，跟我墨迹了两个小时，还没给我办好，我真是无语了，对那个京东女客服太不满意了,1,2017-11-13 14:28:04,j***b,曜石黑,nova 2 plus 64GB,普通版,来自京东Android客户端,金牌会员
17842,17842,HUAWEI nova 2 Plus,郁闷至极。刚拍完五分钟，就出新优惠，下单立减50。而且还各种礼品。前后几分钟的事儿。。非常不满意。。。,1,2017-11-13 12:21:22,刘***1,草木绿,nova 2,普通版,来自京东iPhone客户端,金牌会员
17843,17843,HUAWEI nova 2 Plus,拉个机自营啊！价格保护就是偷奸耍滑，双十一前两天买的，说价格保护就妥妥的买了，双十一当天也没来退差价，12/13号连着和客服沟通，一直叫我找京东客服 ，手机上申请价格保护不通过。手机价格是2399一直没变，可是优惠券从200变成250了，13号终于电联上客服了，居然要我重新下单才给退优惠券差价，关键是经历双十一，没货了，我这个地区没货。谁晓得你的差价退的如此奇葩！谁晓得优惠券差价手机上不能申请要找客服手动申请，谁晓得要重新下个订单，我早晓得双十一当天就来找你了啊，体谅你活动当天各种火爆对吧呵呵 。早有耳闻不如眼见为实，京东售后超级拉个机,1,2017-11-13 11:07:29,p***t,曜石黑,nova 2 plus 64GB,普通版,来自京东Android客户端,钻石会员
17844,17844,HUAWEI nova 2 Plus,没有赠品，忽悠了,1,2017-11-12 21:28:19,j***龙,玫瑰金,nova 2 plus 128GB,普通版,来自京东iPhone客户端,钻石会员
17845,17845,HUAWEI nova 2 Plus,破破手机买过来三个月外婆坏了两次，内屏坏了一次，跑了四家手机店，四个修手机的都说这个内屏绝对不是原装的，内屏现在还在这里，以前感觉京东假货少，现在感觉假货多的很！,1,2017-11-13 21:42:50,1***p,玫瑰金,nova 2,普通版,来自京东iPhone客户端,金牌会员
17846,17846,HUAWEI nova 2 Plus,后悔了。买了后商家成大爷了问个问题都狂的要死。后悔买这台手机了。有指纹解锁什么的微信却设置不了指纹支付！！！醉了  尤其客服的态度真心醉了！！！！！！,1,2017-11-12 21:10:30,j***8,玫瑰金,nova 2 plus 128GB,普通版,来自京东Android客户端,银牌会员
17847,17847,HUAWEI nova 2 Plus,烂手机，卡顿厉害的，还的第二部，差距这么大？坑die呢是不是，杀必京东,1,2017-11-12 19:20:40,二***丶,曜石黑,nova 2,普通版,来自京东iPhone客户端,金牌会员
17848,17848,HUAWEI nova 2 Plus,差评，京东竟然打价格战，不靠谱，再买东西要慎重！！！！！,1,2017-11-12 18:35:48,吴***8,曜石黑,nova 2,普通版,来自京东Android客户端,PLUS会员
17849,17849,HUAWEI nova 2 Plus,收到的货物与活动内容严重不符，说赠自拍杆就没收到，客服态度恶劣，无法沟通,1,2017-11-12 16:03:06,z***y,玫瑰金,nova 2,普通版,来自京东Android客户端,银牌会员
17850,17850,HUAWEI nova 2 Plus,比实体店卖的还贵，不好，质量一般，也不知道是不是真货，和实体店的有点不一样。,1,2017-11-12 15:41:48,s***y,玫瑰金,nova 2 plus 64GB,普通版,来自京东Android客户端,金牌会员
17851,17851,HUAWEI nova 2 Plus,"垃 圾 
的京东，现在是店大欺客了！前几天首页明确表示大家可以放心购买，若有出现双十一降价将退差价，这才一周时间就降价180，现在还不给退差价！做不到就不要承诺！真是可恶，这么大的公司现在也搞这么一出，真是三十年河东 三十年河西！",1,2017-11-12 12:24:12,k***g,极光蓝,nova 2 plus 64GB,普通版,来自京东iPhone客户端,钻石会员
17852,17852,HUAWEI nova 2 Plus,京东客服真让人无语，双十一前两天买的，想到能退差价就买了，结果当天降价180各种理由不给退差价,1,2017-11-12 09:33:10,B***0,流光金,nova 2 plus 64GB,普通版,来自京东Android客户端,金牌会员
17853,17853,HUAWEI nova 2 Plus,手感不好 不好用 给老人用了，后悔买了！,1,2017-11-11 23:53:42,z***c,流光金,nova 2,普通版,来自微信购物,银牌会员
17854,17854,HUAWEI nova 2 Plus,页面上写的下单送自拍杆变成了送完为止。送赠品写得那么醒目，赠品送完为止的规则躲在犄角旮旯，而且写的是满19送赠品，送完为止，根本没提到是自拍杆送完为止。另外赠品数量是多少呢，1个还是100个?完全不透明，毫无送赠品的诚意。在京东上买了很多次电子产品了，这次被欺骗得最不爽了。,1,2017-11-11 20:57:20,s***8,流光金,nova 2 plus 128GB,普通版,来自京东Android客户端,钻石会员
17855,17855,HUAWEI nova 2 Plus,买的时候显示是双十一活动，以为可以放心先买啦。结果双十一又降价！！！京东这么大的企业，诚信不重要吗？联系客服，结果客服说&ldquo;感谢您对华为产品的关注！华为产品是厂家直供定价销售的，价格以京东商城页面显示为准，华为客服是无权调整价格的呢，感谢您的理解和支持~&rdquo;，我找客服是为了解答疑问，结果给我往出一推，还要我理解和支持。。。请问这就是你们对客户的理解和支持？？？,1,2017-11-11 20:44:04,j***4,草木绿,nova 2,普通版,,PLUS会员
17856,17856,HUAWEI nova 2 Plus,手机一般般，最恼火的是11月7号买的时候说如果降价了补差价，2599买的，现在到手2499这不是欺诈消费者吗？本来打算双11买的，店家承诺降价补差价才提前买了，现在找人问根本没人搭理！一直用的华为手机，第一次在京东上买，太尼吗坑了，你做不到就不要承诺人家不是100块钱的事！,1,2017-11-11 20:40:22,j***e,草木绿,nova 2 plus 128GB,普通版,来自京东Android客户端,金牌会员
17857,17857,HUAWEI nova 2 Plus,双十一当天买还不一样，买了之后又说有赠品送，我的就没送，差评！,1,2017-11-11 19:05:41,j***1,玫瑰金,nova 2 plus 128GB,普通版,来自京东Android客户端,PLUS会员
17858,17858,HUAWEI nova 2 Plus,手机暂时没发现啥毛病！最让人气愤的是送了个假货，送的自拍杆充不进去电，离了插座就是个摆设，还标着待机时间1年！！！！你咋不说十年呢！,1,2017-11-11 18:26:39,j***j,曜石黑,nova 2,普通版,来自京东Android客户端,银牌会员
17859,17859,HUAWEI nova 2 Plus,两个多月就出现各种问题，莫名的打不出电话，接不了电话还不知道为啥呼叫转移，莫名其妙的微信qq被删掉～～～我的心好塞啊,1,2017-11-11 18:09:24,j***h,极光蓝,nova 2 plus 128GB,普通版,来自京东Android客户端,银牌会员
17860,17860,HUAWEI nova 2 Plus,保价都是假的，问客服退钱都没人搭理，越来越假，骗＆子,1,2017-11-11 18:04:59,j***2,玫瑰金,nova 2,普通版,来自京东Android客户端,PLUS会员
17861,17861,HUAWEI nova 2 Plus,说好的保价呢，根本骗人的,1,2017-11-11 16:49:53,x***8,曜石黑,nova 2,普通版,来自京东Android客户端,金牌会员
17862,17862,HUAWEI nova 2 Plus,强卖强卖，哎下次再也不在京东买东西了。。服务太差,1,2017-11-11 16:36:52,j***0,流光金,nova 2,普通版,来自京东Android客户端,银牌会员
17863,17863,HUAWEI nova 2 Plus,京东就是个坑货。什么价保都是骗人的,1,2017-11-11 14:46:35,n***u,曜石黑,nova 2,普通版,来自京东iPhone客户端,银牌会员
17864,17864,HUAWEI nova 2 Plus,新买的手机，进优酷视频就卡顿，充电时间长，卖家态度极其不好,1,2017-11-11 14:00:26,j***1,草木绿,nova 2,普通版,来自京东Android客户端,银牌会员
17865,17865,HUAWEI nova 2 Plus,这个机子，宣传的好，喜欢了半年，拿到手，没有惊喜，手机触屏不是很灵，有时候按不动，价格，刚买四五天，降价很多，还能用三个字，你懂的，总之，不值，没有我原来的oppor9好！想买的慎重吧！实体店先看看在网上买,1,2017-11-11 13:07:30,桂***4,草木绿,nova 2,普通版,来自京东Android客户端,金牌会员
17866,17866,HUAWEI nova 2 Plus,京东当消费者是白痴，原价一直没变，就是优惠券更优惠了，不算是减价？！这种变相忽悠消费者做得也太恶心了吧！说好在11月12号之前减价会跟差价的呢？客服给说算，连赠品的价也加上才能减，你们赠品本身购买时是0.00元吧，说之前买的价格比双11的更优惠了，呵呵。店大欺客！,1,2017-11-11 11:54:04,G***果,草木绿,nova 2,普通版,,金牌会员
17867,17867,HUAWEI nova 2 Plus,价格不稳定，坑消费者，刚买有一周就降价，呵呵了,1,2017-11-11 11:39:48,飞***梦,玫瑰金,nova 2 plus 128GB,普通版,来自京东Android客户端,金牌会员
17868,17868,HUAWEI nova 2 Plus,你好，我双十一之前1千9百多买了这个，有双十一保价的，但双十一了就可以1千8百多到手，用优惠券减掉的，便宜了，但这不属于价保的流程，因为优惠券变了大点的券，总金额没变，因为手机已开包也没办法退了，双十一之前用这样的手段哄人上钩，绝对要差评。各位路过的人看准了电商们挖的坑，无商不jian。,1,2017-11-11 13:02:27,F***A,极光蓝,nova 2,普通版,来自京东Android客户端,金牌会员
17869,17869,HUAWEI nova 2 Plus,感觉被骗，前几天买1949，现在1869。?不是说双11期间都不降价的吗？,1,2017-11-11 12:42:15,j***b,玫瑰金,nova 2,普通版,来自京东Android客户端,金牌会员
