,Unnamed: 0,model,content,score,creationTime,nickname,productColor,productSales,productSize,userClientShow,userLevelName
18244,18244,HUAWEI nova 2 Plus,不能充电,3,2018-02-18 22:41:46,j***g,玫瑰金,nova 2,普通版,来自京东Android客户端,银牌会员
18245,18245,HUAWEI nova 2 Plus,我买了两个，前几天买的一个黑色，感觉挺好，又买了这个！结果黑色的尽然没两天充不进去电了，我晕，这质量是不是有点过了！就买山寨机吧！也不能这么渣吧！,2,2018-02-18 10:56:02,j***z,玫瑰金,nova 2,普通版,来自京东Android客户端,银牌会员
18246,18246,HUAWEI nova 2 Plus,说实话华为自己的处理器还算一般吧，但是降价降得也太厉害了吧！一个月从*到*我的天过分了啊,3,2018-02-16 15:34:38,京***吧,曜石黑,nova 2 plus 128GB,普通版,来自京东Android客户端,银牌会员
18247,18247,HUAWEI nova 2 Plus,机身内有异响，照相的颜色失真。,3,2018-02-15 01:49:35,c***h,曜石黑,nova 2,普通版,来自微信购物,银牌会员
18248,18248,HUAWEI nova 2 Plus,新机有卡顿我不能理解。,3,2018-02-13 23:10:21,张***4,曜石黑,nova 2,普通版,来自京东Android客户端,银牌会员
18249,18249,HUAWEI nova 2 Plus,手机还好吧，二兽东的正宗产品，急用就没想着换了，京东的老客户了，相信一次吧,3,2018-02-13 19:25:15,c***s,曜石黑,nova 2,普通版,来自京东Android客户端,PLUS会员
18250,18250,HUAWEI nova 2 Plus,京东现在不行了，刚开始，只要是京东自营的都免运费，京东钻石会员才有点用，金牌会员都和刚注册的会员一样。现在钻石会员:也要79才免运费。金牌要99。京东现在变的让人不认识了。,2,2018-02-13 12:39:30,兰***魔,玫瑰金,nova 2 plus 128GB,普通版,来自京东Android客户端,金牌会员
18251,18251,HUAWEI nova 2 Plus,第一次收到手机拍照发现屏幕会有黑色的竖线，退回去换，在路上走了5天才收到。主要看中手机的内存大，外观漂亮，其他像照相都一般，感觉没我之前用的好，需求不大，能用就行。,3,2018-02-11 17:11:24,j***0,玫瑰金,nova 2 plus 128GB,普通版,,金牌会员
18252,18252,HUAWEI nova 2 Plus,手机还是可以的  外观很漂亮  但手机不是全新的  背面还有指纹   摄像头那块有一块黑东西  快过年了也懒得退换了 这是在京东自营买的最差的东西,3,2018-02-11 12:47:23,j***l,玫瑰金,nova 2,普通版,来自京东Android客户端,金牌会员
18253,18253,HUAWEI nova 2 Plus,不吹不黑，网购这么多年来，第一次给这么低的评价，一部分给这个手机，一部分给客服吧。一直都是挺支持华为，支持京东的。但是这次真的糟心，期待了好久的手机莫名发现呼吸灯竟然在听筒上面，别的问题暂时没有发现，找了客服无数遍竟然没有人理我？可能是新年比较忙吧，但是连续两天找不到人真的心塞塞&hellip;,2,2018-02-11 10:45:28,j***j,曜石黑,nova 2 plus 128GB,普通版,来自京东Android客户端,银牌会员
18254,18254,HUAWEI nova 2 Plus,用于年会礼品,3,2018-02-11 09:24:58,f***n,极光蓝,nova 2 plus 128GB,普通版,,企业会员
18255,18255,HUAWEI nova 2 Plus,机子还行，就是后盖摄像头旁边漆面颜色不对称感觉被打开过是二手货，京东送货挺快,2,2018-02-11 08:59:45,j***c,曜石黑,nova 2,普通版,来自京东Android客户端,银牌会员
18256,18256,HUAWEI nova 2 Plus,给妈妈买的，尺寸大小合适老人用，手写输入法略显迟钝，没装什么App感觉滑动运行程序会有点点滞后感。麒麟还是不如骁龙啊,2,2018-02-10 23:08:39,柳***奇,流光金,nova 2,普通版,,PLUS会员
18257,18257,HUAWEI nova 2 Plus,外观看着很小巧试用&hellip;电池耐用耗电度一般&hellip;才拍回来&hellip;用过一段时间看看怎么样,3,2018-02-10 22:44:16,j***a,曜石黑,nova 2,普通版,来自京东Android客户端,金牌会员
18258,18258,HUAWEI nova 2 Plus,包装简单，耗电量快，刚充满电，没有玩到下午五点就耗下去了百分之五的电，我还是开的比较省点的模式。京东客服电话也没有人接，不知道这款手机是不是电量就这样，但觉得电量好垃圾。,2,2018-02-10 17:39:32,j***q,玫瑰金,nova 2,普通版,来自京东Android客户端,银牌会员
18259,18259,HUAWEI nova 2 Plus,手机还没有怎么用，没以前好了华为手机,2,2018-02-10 15:23:41,j***7,草木绿,nova 2,普通版,来自京东Android客户端,银牌会员
18260,18260,HUAWEI nova 2 Plus,手机是用一个小箱子装的，箱子里还留有一个足以放下一个充电宝的空间（没送充电宝），手机在运送途中会在里面摇来晃去，不知会不会受到损坏，先用用看吧,3,2018-02-10 10:46:29,j***7,草木绿,nova 2 plus 128GB,普通版,来自京东Android客户端,银牌会员
18261,18261,HUAWEI nova 2 Plus,手机质量太差，经常卡屏，半天运转不过来,2,2018-02-10 08:52:24,何***1,玫瑰金,nova 2 plus 128GB,普通版,来自京东Android客户端,PLUS会员
18262,18262,HUAWEI nova 2 Plus,卡槽质量非常之垃圾一半塑料一半铝合金    盒子明显的拆过的痕迹   手机出厂膜是后贴上去的 里面还有橡皮擦过碎屑在里面,3,2018-02-09 14:43:47,钰***勒,曜石黑,nova 2,普通版,来自京东iPhone客户端,银牌会员
18263,18263,HUAWEI nova 2 Plus,耗电太快了,3,2018-02-09 13:47:12,j***7,玫瑰金,nova 2,普通版,来自京东Android客户端,银牌会员
18264,18264,HUAWEI nova 2 Plus,不咋地  手机电不经用   超级耗电 手机是挺好看的,3,2018-02-08 17:30:08,j***a,玫瑰金,nova 2,普通版,来自微信购物,银牌会员
18265,18265,HUAWEI nova 2 Plus,买回来用了一个半月才来评价的，这手机介绍上说的是拍照很好，实际却是差的很，2000万像素的前置自拍摄像头，拍出的照片放大一点看看全是一片模糊和斑点，远一点的根本无法看清楚！还有摇一摇功能都不能用，根本就不像介绍说的那样，对这款手机比较失望啊！,3,2018-02-08 12:33:24,j***_,曜石黑,nova 2 plus 64GB,普通版,来自微信购物,银牌会员
18266,18266,HUAWEI nova 2 Plus,手机的反应速度，信号，拍照啊都不太好，电池勉强可以。,2,2018-02-07 20:56:43,j***0,曜石黑,nova 2,普通版,来自京东Android客户端,金牌会员
18267,18267,HUAWEI nova 2 Plus,京东速度快态度好值得表扬。但是nova2质量是真的差。以后不会在买华为了。,3,2018-02-07 01:07:10,j***j,流光金,nova 2,普通版,来自京东iPhone客户端,银牌会员
18268,18268,HUAWEI nova 2 Plus,为什么玻璃膜是破的，又不是送的膜，我可是花钱买的，这么不负责任吗,2,2018-02-06 11:05:21,j***a,曜石黑,nova 2,普通版,来自微信购物,银牌会员
18269,18269,HUAWEI nova 2 Plus,手机旧的，刚退了一个，这个不想再退了，心累，手机指纹位置的缝隙里竟然有灰尘醉了。,3,2018-02-05 23:58:41,呵***了,曜石黑,nova 2 plus 128GB,普通版,来自京东Android客户端,PLUS会员
18270,18270,HUAWEI nova 2 Plus,手机很好，手感不错，还没有时间去捣鼓这手机，刚才试了试，发现这蓝牙配对不上，链接不上，试了几个手机都链接不上，客服这是什么情况啊？,3,2018-02-05 23:39:13,爸***萱,玫瑰金,nova 2,普通版,来自京东Android客户端,银牌会员
18271,18271,HUAWEI nova 2 Plus,充电很慢，申请不了售后,2,2018-02-05 15:24:01,韦羽凡,流光金,nova 2,普通版,来自京东Android客户端,金牌会员
18272,18272,HUAWEI nova 2 Plus,一般，不建议购买，不值这个价格！,3,2018-02-05 09:35:44,看***人,曜石黑,nova 2 plus 64GB,普通版,来自京东iPhone客户端,PLUS会员
18273,18273,HUAWEI nova 2 Plus,这京东现在的快递包装也是醉了，连个塑料泡沫都舍不得放吗？？？包装盒一角有摔的痕迹，不过手机没什么大问题，但是里边有没有摔出小问题就不清楚了，京东的速度还是很快，当天就到了，就这个包装我只能给两星了,2,2018-02-05 08:37:15,画***丶,曜石黑,nova 2,普通版,来自京东iPhone客户端,钻石会员
18274,18274,HUAWEI nova 2 Plus,薄，挺好看，应该是正品，内存剩107，性价比正常，看别人评价，都说卡，确实不是很快，就是正常吧，不是特别快，也不卡，不知道用久了怎么样，总体感受一般,3,2018-02-04 23:28:19,z***r,曜石黑,nova 2 plus 128GB,普通版,来自京东Android客户端,金牌会员
18275,18275,HUAWEI nova 2 Plus,为什么没有发票？？？？？？,3,2018-02-04 14:32:40,j***5,流光金,nova 2,普通版,,金牌会员
18276,18276,HUAWEI nova 2 Plus,心好累 我今天拿到货   本来要退货的  **的   不想骂人的   京东太垃圾了  外面脏脏的   里面的数据线好像有人用过的一样  是散的,3,2018-02-04 11:24:21,j***t,流光金,nova 2,普通版,来自京东Android客户端,银牌会员
18277,18277,HUAWEI nova 2 Plus,说一下吧，我就感觉送的东西太少了，手机是挺轻薄的，有点仿苹果，不错的感觉，现在目前感觉是还行，至于后来用了一段时间会怎样就不知道了，等用的比较好了再来追评。京东客服的态度我感觉需要提高一下子。附一张女神的照片吧。懒得去拍手机了。,3,2018-02-04 08:28:29,好***t,玫瑰金,nova 2,普通版,来自京东Android客户端,PLUS会员
18278,18278,HUAWEI nova 2 Plus,屏幕太差，对屏幕质量要求高或者近视眼的还是别用这款，最近一周买了两次京准达没一次准点过,3,2018-02-04 01:42:27,点***c,草木绿,nova 2 plus 128GB,普通版,来自京东Android客户端,金牌会员
18279,18279,HUAWEI nova 2 Plus,"优点：颜值高手感好，系统还是挺流畅的，充电1.5小时还算可以吧。自拍像素很清晰
缺点：1、每次放下攝像头有松动和响声，华为的回复令人不能接受，怎么不见我的其它手机或相机或单反放下时有响声呢？
2、光学变焦完全忽悠用户的，其实就是在数码变焦的基础上放大一级，注意是一级并不是无极变焦，数码变焦后的照片我想大家都懂的。
3、双攝作用不大，拍出来的照片和同品牌单摄的效果很难区分。
4、啦叭确实存在破音。
5、电池相对以前的G9移动版有退步，中度使用1天，G9可1.5至2天。
6、通话音也比G9有所减少，如果在很吵的地方可能有点免强。
7、电源键稍松，放口袋经常碰到亮屏，锁屏情况下下拉菜单也能拉下来导致误碰
以上是个人使用一星期感受
总结：颜值好，自拍清晰，价钱高，缺点一大堆",3,2018-02-04 01:32:41,a***標,曜石黑,nova 2,普通版,来自京东Android客户端,银牌会员
18280,18280,HUAWEI nova 2 Plus,性价比不行，只冲牌子去的又需要小手机的基本只能选这款了&hellip;&hellip;,3,2018-02-03 17:58:52,超***箱,极光蓝,nova 2,普通版,来自京东iPhone客户端,钻石会员
18281,18281,HUAWEI nova 2 Plus,第一次在网上买手机，用了一个多月，还行吧！不过用微信视频的时候机身发热,3,2018-02-03 16:56:58,e***K,极光蓝,nova 2 plus 64GB,普通版,来自微信购物,金牌会员
18282,18282,HUAWEI nova 2 Plus,气氛啊，原价*，什么领券200，再减200，*，刚买2天就掉了100，全是慌人的。开机慢，充电还可以，款式漂亮，小巧，再也不相信京东的满呀减啊，衣服也一样。失望,2,2018-02-03 07:40:23,l***0,玫瑰金,nova 2,普通版,来自微信购物,钻石会员
18283,18283,HUAWEI nova 2 Plus,用了几天感觉反应就慢了，建议不要买这款只有外形还可以,3,2018-02-02 21:56:05,j***5,玫瑰金,nova 2,普通版,来自京东Android客户端,银牌会员
18284,18284,HUAWEI nova 2 Plus,不是我说啊，商家服务态度真不热心，卖的手机连包装袋都没寄过来，什么东西都没有送，都是手机原有的配置，京东除了物流挺好，一次不开心的购物,3,2018-02-02 20:35:40,j***r,草木绿,nova 2,普通版,来自京东Android客户端,铜牌会员
18285,18285,HUAWEI nova 2 Plus,我使用几天发现接电话时，音质不满意，需要申请退货，可是当时把包装袋搞丢了，上门取件的快递公司不收，打华为售后服务，他们让我找京东，请问我应该怎么处理，请及时跟我沟通，谢谢！,2,2018-02-02 11:13:30,j***9,玫瑰金,nova 2,普通版,来自京东Android客户端,银牌会员
18286,18286,HUAWEI nova 2 Plus,手机挺薄的，充电也没有想他们说的热，但是有一点有时候闪退,2,2018-02-01 21:01:05,j***b,玫瑰金,nova 2 plus 128GB,普通版,来自京东Android客户端,银牌会员
18287,18287,HUAWEI nova 2 Plus,也是年货节，贵100块的小米note3比这个强几倍，两台手机都是新的，看来以后还是得买小米。。。,3,2018-02-01 14:40:31,L***L,流光金,nova 2,普通版,来自京东Android客户端,银牌会员
18288,18288,HUAWEI nova 2 Plus,手机外观很不错，配置看上去还行，但是用起来多开两个app就开始卡，直接卡死，等个二三十秒才反应过来，用了不到两个月，说实话用户体验不行，毕竟新机型。以后还是长点心吧，好好整行不？,3,2018-02-01 13:24:57,我***来,曜石黑,nova 2,普通版,,银牌会员
18289,18289,HUAWEI nova 2 Plus,手机还行，但是买了第二天就降价300，哎！,3,2018-02-01 12:40:46,j***g,流光金,nova 2,普通版,,金牌会员
18290,18290,HUAWEI nova 2 Plus,用了几天，有些卡顿现象，开始以为信号不好，后来无线下也是卡顿，不知道什么原因。,3,2018-01-31 23:18:23,雷***o,流光金,nova 2,普通版,来自京东Android客户端,金牌会员
18291,18291,HUAWEI nova 2 Plus,卡,3,2018-01-31 12:22:00,b***_,曜石黑,nova 2,普通版,来自京东iPhone客户端,钻石会员
18292,18292,HUAWEI nova 2 Plus,还不错，挺好看，速度还可以，就是隐藏按键不怎么喜欢，看着好像屏更小了,3,2018-01-31 11:37:44,j***9,玫瑰金,nova 2,普通版,来自京东Android客户端,铜牌会员
18293,18293,HUAWEI nova 2 Plus,总体还可以，喜欢它的外观，手感比较适合女生，性能过得去，拍照比较艺术化，我个人不是很喜欢，感觉有点点失真，不自然。一直没细看，用了一段时间才发现中间有一条&ldquo;彩色的细线&rdquo;，像清水滴在屏幕去那样子的色彩，开始以为是水，但试了发现擦不掉，才发现是屏幕本身的问题。发现时已过了退保期，返修也麻烦，将就用了。只是这属于商品本身的质量问题，到底是厂家漏检了还是商家卖瑕疵品就不得而知了。希望性能稳定，要不真对京东无语了。,3,2018-01-31 10:51:07,j***c,流光金,nova 2,普通版,来自京东Android客户端,银牌会员
18294,18294,HUAWEI nova 2 Plus,第一次购买的手机，因屏幕显示偏黄进行换货，等了一个星期才换货。收到的换货手机到现在一个月了，时不时（刚刚都卡死了一次）打开微信就卡死，提醒要么等待要么关闭程序。每次都要关闭程序重启。估计就是两三天就出现一次，啥程序不运行就开个微信都卡死。,2,2018-01-31 10:39:54,白***莉,极光蓝,nova 2,普通版,来自微信购物,金牌会员
18295,18295,HUAWEI nova 2 Plus,用着非常卡,2,2018-01-31 10:05:20,j***u,玫瑰金,nova 2 plus 128GB,普通版,来自京东Android客户端,银牌会员
18296,18296,HUAWEI nova 2 Plus,不开心，买了才不到二十天就降价了，手机总体来说还行吧,3,2018-01-31 10:04:21,j***9,曜石黑,nova 2 plus 64GB,普通版,来自京东Android客户端,银牌会员
18297,18297,HUAWEI nova 2 Plus,1月27号晚上到的手机，我贴了膜按了壳，1月30号晚上，拿着手机发信息，掉地上了，屏幕碎的惨不忍睹，用了这么多年的手机，这是我买的最贵的手机，也是最让我心碎的手机。我是刚出来工作的，薪水微薄，一个多月薪水买了手机，用了72个小时屏幕就碎成了渣，我不知道用什么言语来描述我此刻的心情。当初买了的时候不知道该在京东上买还是该在**上买，后来果断选择了京东，然后京东的质量我也是体会到了。买手机的时候不知道该买华为还是还买小米或者其他，我又果断的选择了华为&hellip;&hellip;我跟我朋友我新买的手机用了三天屏幕碎成了渣，她却告诉我&ldquo;我买的XX手机今天掉水里两次了，拿起来视频都还一直在播放，啥事没有，摔了多次也没有碎屏啊。&rdquo;??????????????,2,2018-01-30 23:32:46,A***w,玫瑰金,nova 2,普通版,来自京东Android客户端,铜牌会员
18298,18298,HUAWEI nova 2 Plus,比想像中的小一些，GPS信用还行，主要用来导航和上微信,3,2018-01-30 21:30:51,c***4,极光蓝,nova 2,普通版,,银牌会员
18299,18299,HUAWEI nova 2 Plus,东西不错，就快递包装太草率了，自己提着回来都听得到手机在里面晃,3,2018-01-30 13:18:52,会***风,玫瑰金,nova 2,普通版,来自京东Android客户端,金牌会员
18300,18300,HUAWEI nova 2 Plus,客服不给力，手机出了点问题联系客服信息都不回,3,2018-01-30 12:48:16,j***d,曜石黑,nova 2 plus 64GB,普通版,来自京东Android客户端,银牌会员
18301,18301,HUAWEI nova 2 Plus,摄像头附近有异响，售后说是自动变焦的部件，为什么P9没有，V9也没有，mate9、10也没有，还有旁边同事最少5款华为的都没有任何响声，难道只有nova2有自动变焦功能，不解?,2,2018-01-29 17:08:44,j***7,曜石黑,nova 2,普通版,来自京东Android客户端,钻石会员
18302,18302,HUAWEI nova 2 Plus,没有发票的,3,2018-01-29 14:14:25,1***m,曜石黑,nova 2,普通版,来自京东Android客户端,银牌会员
18303,18303,HUAWEI nova 2 Plus,这个价位的手机，买就要有心理准备，不要妄想和自己大几千的手机比，那不是一样的价钱，总体感觉还行吧，就是这双摄，貌似真是个噱头，这三个星不是给京东的，是给华为的，建议华为做良心产品,3,2018-01-29 03:01:41,jd_186854iia,流光金,nova 2,普通版,来自京东iPhone客户端,银牌会员
18304,18304,HUAWEI nova 2 Plus,不开心 一样礼品都没有?,2,2018-01-29 00:30:35,渺***游,玫瑰金,nova 2 plus 128GB,普通版,来自京东Android客户端,银牌会员
18305,18305,HUAWEI nova 2 Plus,一般般，总体可以，没有想象那么好哦哦哦,3,2018-01-28 22:01:47,小***凯,流光金,nova 2 plus 64GB,普通版,来自京东iPhone客户端,PLUS会员
18306,18306,HUAWEI nova 2 Plus,刚买没几天就降价了，白白损失了*元,2,2018-01-30 00:16:16,郭***1,曜石黑,nova 2,普通版,来自京东Android客户端,金牌会员
18307,18307,HUAWEI nova 2 Plus,外形很漂亮！手感也好！薄厚适宜！我之前用的荣耀8，这两款手机比较，还是8性价比更高高些！这款手机触屏健没有8伶敏，有时候按好几下都没反应，且程序经常卡，或者自己退出来，所以我个人觉得还是荣耀8更值得够买,3,2018-01-28 21:44:43,y***4,流光金,nova 2 plus 64GB,普通版,来自京东Android客户端,钻石会员
18308,18308,HUAWEI nova 2 Plus,主要是大小合适，单手拿着方便，配置不如荣耀7，**网上开户需要提交视频验证一直提示错误，用荣耀7一次成功。看来处理器较为差劲。喇叭声音中等就差效果，也不清楚是不是都这样。,3,2018-01-28 13:46:41,i***6,曜石黑,nova 2,普通版,来自京东Android客户端,PLUS会员
18309,18309,HUAWEI nova 2 Plus,按键在屏幕里面，不好用，觉得华为怎么好,2,2018-01-27 21:45:26,j***l,玫瑰金,nova 2,普通版,来自京东Android客户端,银牌会员
18310,18310,HUAWEI nova 2 Plus,手机很漂亮，我想问华为手机为什么是京东的外封？希望可以好用，也希望不是被退货的手机！京东，希望你的售前售后可以跟上，太差了客服！,3,2018-01-27 08:40:31,g***L,流光金,nova 2,普通版,来自京东Android客户端,金牌会员
18311,18311,HUAWEI nova 2 Plus,用了几天，感觉不是太好用！这个手机容易闪退，还比较卡！总之体验感不是太好,2,2018-01-25 21:35:06,j***点,极光蓝,nova 2,普通版,来自京东Android客户端,银牌会员
18312,18312,HUAWEI nova 2 Plus,手机本来就有配原装膜还弄个带膜的套餐，有被骗的感觉,3,2018-01-25 21:12:25,j***e,玫瑰金,nova 2,普通版,来自微信购物,银牌会员
18313,18313,HUAWEI nova 2 Plus,一分钱一分货,3,2018-01-25 15:32:34,j***f,玫瑰金,nova 2,普通版,来自京东iPhone客户端,银牌会员
18314,18314,HUAWEI nova 2 Plus,买了差不多半个月  降价400???,3,2018-01-25 14:14:44,徐***哈,玫瑰金,nova 2 plus 128GB,普通版,来自京东Android客户端,银牌会员
18315,18315,HUAWEI nova 2 Plus,"我可能买到了假华为，用到一个月的时候就开始卡，音乐播放会显示：暂时无响应，您是等待还是关闭。
           几个页面之间转换会停很久！听音乐的质量也不是很好。
玩王者，英雄完全找不着北，手指一直操作，英雄就像是个小丑一样。傻傻的
华为还是不错的，只是为什么我买的用到一个月的时候，就发生这些情况。怀疑",3,2018-01-25 14:06:18,C***N,玫瑰金,nova 2 plus 128GB,普通版,来自京东Android客户端,银牌会员
18316,18316,HUAWEI nova 2 Plus,刚买，马上就降价了，坑死了，喇叭有点沙哑，如果歌放久了，就是出现噪音，外观很漂亮，相机很好，感觉会卡,3,2018-01-25 12:35:02,筱***5,玫瑰金,nova 2,普通版,来自京东Android客户端,银牌会员
18317,18317,HUAWEI nova 2 Plus,东西还是可以的，但是刚买就降价，心理很难受。,3,2018-01-24 19:04:15,笑***彬,流光金,nova 2,普通版,来自京东iPhone客户端,银牌会员
18318,18318,HUAWEI nova 2 Plus,手机用起来感觉还不错，但是特别不好的就是照相为什么这么模糊啊，真的是受不了，我觉得大家要买的话还是考虑其他款的手机吧！照相真的是太差了，还是我不会使用这个相机？！,3,2018-01-24 00:12:34,j***f,流光金,nova 2 plus 64GB,普通版,来自京东Android客户端,银牌会员
18319,18319,HUAWEI nova 2 Plus,心塞，一买完又便宜了100块。再好用都不舒服啊。,3,2018-01-23 14:32:50,j***溪,玫瑰金,nova 2,普通版,来自京东Android客户端,银牌会员
18320,18320,HUAWEI nova 2 Plus,电池不耐用，其他可以,3,2018-01-22 20:32:21,j***f,极光蓝,nova 2,普通版,来自微信购物,银牌会员
18321,18321,HUAWEI nova 2 Plus,华为没有性价比,3,2018-01-22 17:56:58,y***u,曜石黑,nova 2,普通版,来自京东Android客户端,金牌会员
18322,18322,HUAWEI nova 2 Plus,刚买就降价400？感觉有点坑,2,2018-01-22 11:40:11,j***煙,曜石黑,nova 2,普通版,来自京东iPhone客户端,金牌会员
18323,18323,HUAWEI nova 2 Plus,用了3个月，才来评价的，手机送话器有问题，里面好像螺丝掉了，非常不满意,2,2018-01-21 21:08:45,j***1,草木绿,nova 2,普通版,来自京东Android客户端,钻石会员
18324,18324,HUAWEI nova 2 Plus,垃圾，买没几天就降价，还没补差价，真的是后悔死,2,2018-01-21 15:51:11,N***7,玫瑰金,nova 2 plus 128GB,普通版,,金牌会员
18325,18325,HUAWEI nova 2 Plus,用没几天感觉拿着烫烫的是正常吗,3,2018-01-21 10:21:29,Snow_Snow_hu,玫瑰金,nova 2,普通版,来自京东Android客户端,银牌会员
18326,18326,HUAWEI nova 2 Plus,买了一个星期降了400块，气的我吐血，京东也太坑了,2,2018-01-21 09:41:00,j***n,玫瑰金,nova 2 plus 128GB,普通版,来自京东Android客户端,金牌会员
18327,18327,HUAWEI nova 2 Plus,10天才发货，没货就没上架!,2,2018-01-21 08:42:07,j***n,流光金,nova 2,普通版,来自京东Android客户端,金牌会员
18328,18328,HUAWEI nova 2 Plus,买完就降价。这点我很接受不了。而且降价的幅度还很高。。。,3,2018-01-21 00:15:25,_***H,玫瑰金,nova 2,普通版,来自京东Android客户端,钻石会员
18329,18329,HUAWEI nova 2 Plus,手机还可以,3,2018-01-20 16:48:46,u***E,极光蓝,nova 2 plus 128GB,普通版,来自京东Android客户端,PLUS会员
18330,18330,HUAWEI nova 2 Plus,也就三颗星吧，包装不错，好像有点杂音，手机反应好像有点不灵敏，有待继续考察。三个星有一颗给快递小哥,3,2018-01-20 11:43:13,始***边,玫瑰金,nova 2 plus 128GB,普通版,来自京东Android客户端,银牌会员
18331,18331,HUAWEI nova 2 Plus,买不到一个星期竟然降价300元！！！在京东购物这么多次，这次真的是再窝火的了。不服。,2,2018-01-20 11:21:39,傲***8,草木绿,nova 2,普通版,来自京东Android客户端,银牌会员
18332,18332,HUAWEI nova 2 Plus,刚买了一天！手机还没到手呢！就降价300,2,2018-01-20 00:18:52,凡***S,曜石黑,nova 2 plus 128GB,普通版,来自京东Android客户端,银牌会员
18333,18333,HUAWEI nova 2 Plus,想问问这款华为手机的屏幕什么做的？太脆弱了，小凳子滑下来屏幕就碎了，而且碎的稀烂。一点抗冲击力都没有，华为以后还是好好把手机质量提上去吧，别让支持者心寒,3,2018-01-19 22:30:58,j***h,玫瑰金,nova 2,普通版,来自京东Android客户端,银牌会员
18334,18334,HUAWEI nova 2 Plus,为什么拍照的效果没有广告的那么好？放大一些就有模糊感，很不喜欢！可以退货吗？,3,2018-01-19 20:28:13,j***g,玫瑰金,nova 2,普通版,来自京东Android客户端,银牌会员
