,Unnamed: 0,model,content,score,creationTime,nickname,productColor,productSales,productSize,userClientShow,userLevelName
22716,22716, 畅享8,手机看着很漂亮，摆弄了半天还是没把卡放进去。用两天才知好不好再评价,5,2018-07-11 15:21:40,j***1,粉色,4GB+64GB,标准版,来自京东Android客户端,金牌会员
22717,22717, 畅享8,给爸爸购买的，之前那部丢了，很心疼，立马买个新的给他，很是喜欢，像素啥的都挺好用的，还送了耳机，很贴心,5,2018-08-14 12:56:48,f***g,金色,3GB+32GB,标准版,来自京东iPhone客户端,PLUS会员
22718,22718, 畅享8,屏幕分辨率够清晰的了，外观也可以手感不错?一千多的手机够用就行,5,2018-07-17 08:08:57,j***k,黑色,4GB+64GB,标准版,来自京东iPhone客户端,金牌会员
22719,22719, 畅享8,满意一天京东购物,5,2018-08-05 18:44:11,五***6,金色,3GB+32GB,标准版,来自京东Android客户端,金牌会员
22720,22720, 畅享8,迫不及待拆开，第一感觉就四个字，完美漂亮,5,2018-08-05 14:20:50,j***c,蓝色,4GB+64GB,标准版,来自京东iPhone客户端,PLUS会员
22721,22721, 畅享8,手机收到了用了两天才来评价，还满意，第一次买京东商城的手机。,5,2018-08-02 21:38:46,F***B,金色,4GB+64GB,标准版,来自微信购物,铜牌会员
22722,22722, 畅享8,送货速度真快，配送员态度也好，实物和网报一样，满喜欢，用后再追评。,5,2018-06-19 18:25:34,j***k,蓝色,3GB+32GB,标准版,来自微信购物,银牌会员
22723,22723, 畅享8,宝贝已收到，这是买的第二台同款手机，送老人的很好用，会继续支持。,5,2018-07-03 14:39:13,Z***7,金色,4GB+64GB,标准版,来自京东iPhone客户端,银牌会员
22724,22724, 畅享8,给老岳父买的，有NFC功能，看看坐公共交通时会不会方便一些。机子很不错，很有质感，屏幕比较大，还有老人功能，还没试。相信华为，我一家人一直用的华为，用了N多个了！物美价廉，值得拥有。,5,2018-07-17 17:21:53,t***p,蓝色,3GB+32GB,全网通NFC版,来自京东Android客户端,钻石会员
22725,22725, 畅享8,手机还可以吧秒杀价便宜了正常使用没啥大问题,5,2018-07-13 14:54:35,j***9,金色,4GB+64GB,标准版,来自京东Android客户端,PLUS会员
22726,22726, 畅享8,买给妈妈用，表示很喜欢，已经放弃苹果了,5,2018-08-09 07:49:39,阿***西,金色,4GB+64GB,标准版,来自京东iPhone客户端,PLUS会员
22727,22727, 畅享8,帮姐姐买的，点名要这款，希望能坚持两年。,5,2018-07-25 22:27:04,回首望暮然流年,蓝色,4GB+64GB,标准版,来自京东iPhone客户端,PLUS会员
22728,22728, 畅享8,机子还不错，就是电池不太耐用，半天就得充电，赠送的礼品也挺好的，,5,2018-06-23 11:30:24,1***p,粉色,4GB+64GB,标准版,来自微信购物,铜牌会员
22729,22729, 畅享8,很漂亮，送耳机，里面还附带手机套，性价比不错！国货加油！！！,5,2018-07-19 11:57:44,精***强,金色,4GB+64GB,标准版,来自京东iPhone客户端,钻石会员
22730,22730, 畅享8,手机不错，运行快，昨天下午付的钱今天早上就收到了物流也快，那么热的天师傅辛苦了。刚开始用，都说HUAWEI不错，第一次买这牌子，相信它。就是手机个人觉得有点长了。别的都不错?。,5,2018-08-06 18:05:45,c***7,金色,4GB+64GB,标准版,来自京东Android客户端,铜牌会员
22731,22731, 畅享8,屏幕很大，续航力比较强大，不错的手机！,5,2018-07-21 16:27:46,j***i,金色,4GB+64GB,标准版,来自京东Android客户端,PLUS会员
22732,22732, 畅享8,给爸爸买的礼物，爸爸很喜欢，用了几天来评价的，爸爸说性能很好,5,2018-07-09 10:00:45,j***s,金色,4GB+64GB,标准版,来自京东iPhone客户端,银牌会员
22733,22733, 畅享8,以前用小米，买华为用了一段时间还不错，没啥问题物流蛮快。,5,2018-08-01 14:58:18,j***y,粉色,4GB+64GB,标准版,来自微信购物,银牌会员
22734,22734, 畅享8,手机看了很久，决定买这一款，非常好,5,2018-08-10 23:03:13,c***6,蓝色,4GB+64GB,标准版,来自京东iPhone客户端,PLUS会员
22735,22735, 畅享8,还可以，这个价位这个配置也算是这样了,5,2018-07-25 11:32:41,h***l,金色,4GB+64GB,标准版,来自京东Android客户端,PLUS会员
22736,22736, 畅享8,丈母娘很满意，屏幕大，速度快，照相清晰，老人嘛，对于内存和运行速度没有太高要求。总之，性价比很高！,5,2018-07-11 14:27:29,胖***Z,金色,3GB+32GB,标准版,来自京东Android客户端,钻石会员
22737,22737, 畅享8,不错，挺好的，细长漂亮，运行流畅，配置主流，全五星好评。,5,2018-07-22 20:42:31,q***0,金色,4GB+64GB,标准版,来自京东Android客户端,金牌会员
22738,22738, 畅享8,这款手机很漂亮，在京东自营买东西就是放心，喜欢用华为手机，,5,2018-07-06 20:47:13,童***贝,粉色,4GB+64GB,标准版,来自京东Android客户端,金牌会员
22739,22739, 畅享8,"老妈很满意，不错的一次购物体验，商家还送了软壳
巴西队加油",5,2018-07-05 11:52:33,彭***检,金色,4GB+64GB,标准版,来自京东Android客户端,金牌会员
22740,22740, 畅享8,很好   帮我爹买的   挺适合的   一家人都用的华为,5,2018-07-21 09:59:40,j***q,黑色,4GB+64GB,标准版,来自京东Android客户端,铜牌会员
22741,22741, 畅享8,好用，一直在京东商城买了很多的东西，这个是帮同事购买的，,5,2018-07-18 13:54:26,j***i,金色,4GB+64GB,标准版,来自京东Android客户端,钻石会员
22742,22742, 畅享8,质量好性价比高新机不卡好用。值得入手,5,2018-07-12 13:23:24,a***7,黑色,4GB+64GB,标准版,来自京东Android客户端,PLUS会员
22743,22743, 畅享8,快递超级快，还是很满意的，华为不错，不知道耗电量怎么样,5,2018-07-24 15:44:41,c***染,黑色,4GB+64GB,标准版,来自京东iPhone客户端,金牌会员
22744,22744, 畅享8,手机大小合适，款式也好看，给老爸买的，黑色没有现货就买了金色，操作也方便，老爸很喜欢，京东物流很快，超级赞！,5,2018-08-26 22:14:41,j***9,金色,3GB+32GB,标准版,来自京东Android客户端,银牌会员
22745,22745, 畅享8,开机很快，玩游戏不卡，感觉手机质量有点轻，其它还行,5,2018-08-06 07:02:28,j***j,黑色,4GB+64GB,标准版,来自京东Android客户端,银牌会员
22746,22746, 畅享8,给哥哥买的，也不知道这个情况怎么样，嗯，你要是买了她给他打游戏玩儿了，便宜，然后看了一下他的这个，嗯，内存也蛮高的，希望用下来还是不错的，好的话下次再来惠顾,5,2018-07-08 20:17:15,忙***n,蓝色,4GB+64GB,标准版,来自京东Android客户端,PLUS会员
22747,22747, 畅享8,京东的物流很快，手机已经用上了，全屏很好用，颜色也好看,5,2018-07-02 21:14:57,j***6,蓝色,4GB+64GB,标准版,来自京东Android客户端,金牌会员
22748,22748, 畅享8,京东自营的速度没得说，试一下没问题，用几天看一下。,5,2018-07-30 09:05:00,j***o,金色,4GB+64GB,标准版,来自京东Android客户端,金牌会员
22749,22749, 畅享8,给老人买的，速度出乎意料的快，非常不错，值得点赞！,5,2018-07-28 12:23:09,七***8,粉色,4GB+64GB,标准版,来自京东Android客户端,银牌会员
22750,22750, 畅享8,屏幕够大了，但充电器不是快充，收货后自己拿去贴膜,5,2018-08-10 13:26:17,点***8,金色,4GB+64GB,标准版,来自京东Android客户端,银牌会员
22751,22751, 畅享8,送给妈妈的，送货速度很快，交互速度也很快，还有拍照效果，妈妈很满意，拿着手机一直在玩，哈哈。相信华为，相信国货！,5,2018-07-07 00:26:10,尛***D,金色,3GB+32GB,标准版,来自京东Android客户端,钻石会员
22752,22752, 畅享8,这个手机更适合男孩子，屏幕长，手机性能ok，功能强大,5,2018-06-29 19:02:18,D***q,金色,4GB+64GB,标准版,来自京东Android客户端,金牌会员
22753,22753, 畅享8,华为畅享8 全面屏三卡槽 3GB+32GB 金色 全网通版 移动联通电信4G手机 双卡双待,5,2018-07-11 13:11:11,岛***船,金色,3GB+32GB,标准版,,PLUS会员
22754,22754, 畅享8,外观美观，手感很好超薄，反应快物流也快,5,2018-07-23 21:23:32,8***u,金色,4GB+64GB,标准版,来自京东Android客户端,钻石会员
22755,22755, 畅享8,老人用，性价比不错。性能也够,5,2018-07-04 18:44:22,9***5,蓝色,4GB+64GB,标准版,来自京东Android客户端,PLUS会员
22756,22756, 畅享8,感觉可以，是不错的选择。,5,2018-07-31 23:23:32,j***4,粉色,4GB+64GB,标准版,来自京东Android客户端,PLUS会员
22757,22757, 畅享8,还没用，看着不错是正品，应该没问题，好评！,5,2018-08-06 14:15:42,j***8,金色,4GB+64GB,标准版,来自京东Android客户端,金牌会员
22758,22758, 畅享8,不错，功能齐全、强大！！！！！,5,2018-07-05 13:16:31,v***t,粉色,4GB+64GB,标准版,来自京东Android客户端,PLUS会员
22759,22759, 畅享8,昨天下午下的单，今天下午送到的，外面还飘着小雨，京东小哥辛苦了。这张相片里的手机，充电器，充电宝，一拖三的线都是京东买的，今天到货。还赠了个耳机,5,2018-08-05 17:57:07,j***0,黑色,3GB+32GB,标准版,来自京东Android客户端,PLUS会员
22760,22760, 畅享8,用了一段时间来评价  真心的不错 非常的好用  物流也非常的快   隔天就到了,5,2018-08-27 18:08:39,Z***u,金色,3GB+32GB,标准版,来自京东Android客户端,PLUS会员
22761,22761, 畅享8,挺好用，屏幕也很大，用起来很顺畅。你值得拥有,5,2018-07-10 18:05:07,j***g,粉色,4GB+64GB,标准版,来自京东Android客户端,金牌会员
22762,22762, 畅享8,帮朋友买的，感觉很好，就是送的耳机是坏的,5,2018-08-08 10:08:09,j***g,粉色,4GB+64GB,标准版,来自京东iPhone客户端,PLUS会员
22763,22763, 畅享8,包装完好无损，目前使用挺好的，后期追加评论！,5,2018-07-08 22:02:44,赵***9,蓝色,4GB+64GB,标准版,来自京东Android客户端,钻石会员
22764,22764, 畅享8,手机使用起来很好，快递给力，工能齐全非常满意,5,2018-07-17 17:05:55,冯***7,蓝色,4GB+64GB,标准版,来自京东Android客户端,银牌会员
22765,22765, 畅享8,第一次在京东买手机，真让我感到意外，第二天早上，当手机交到我手中时，心中暗暗想，这就是京东速度了,5,2018-09-11 15:26:53,梦***妹,金色,3GB+32GB,标准版,来自京东Android客户端,铜牌会员
22766,22766, 畅享8,物美价廉，非常漂亮，好评！,5,2018-04-06 07:59:22,h***3,蓝色,3GB+32GB,标准版,来自京东Android客户端,PLUS会员
22767,22767, 畅享8,商品不错，我们家的手机一直在京东上买。,5,2018-08-02 08:48:27,为***活,金色,4GB+64GB,标准版,来自京东Android客户端,金牌会员
22768,22768, 畅享8,不错不错老年人用已经很不错了,5,2018-05-22 11:34:03,风***雪,蓝色,4GB+64GB,标准版,来自京东Android客户端,PLUS会员
22769,22769, 畅享8,手机质量不错拍照效果不错快递挺快的我很满意,5,2018-06-28 21:53:16,j***a,金色,4GB+64GB,标准版,来自京东Android客户端,银牌会员
22770,22770, 畅享8,此用户未填写评价内容,5,2018-07-11 14:51:49,i***1,粉色,3GB+32GB,标准版,来自京东iPhone客户端,PLUS会员
22771,22771, 畅享8,买完没几天就降价了，给退了差价，用着还行,5,2018-07-10 20:13:12,j***5,黑色,4GB+64GB,标准版,来自京东Android客户端,钻石会员
22772,22772, 畅享8,这次快递小哥因为货物太多导致送货延迟，可以理解。天气炎热，多谢快递小哥送货.,5,2018-07-25 21:57:03,追***风,金色,3GB+32GB,标准版,来自京东iPhone客户端,PLUS会员
22773,22773, 畅享8,帮朋友买的，质量很好，是正品，支持国货。,5,2018-06-24 05:51:43,钱***p,金色,4GB+64GB,标准版,来自京东Android客户端,银牌会员
22774,22774, 畅享8,一分钱一分货，做工什么的没有麦芒好。,5,2018-07-18 21:16:15,恰***年,金色,4GB+64GB,标准版,来自京东iPhone客户端,钻石会员
22775,22775, 畅享8,物流很快，手机还行，用几天再来评评,5,2018-07-31 18:10:30,惗***丶,黑色,4GB+64GB,标准版,来自京东iPhone客户端,金牌会员
22776,22776, 畅享8,外观和手感都还不错，期待用起来也不错！,5,2018-06-30 16:14:05,w***8,粉色,4GB+64GB,标准版,来自京东Android客户端,金牌会员
22777,22777, 畅享8,买的东西太多了，一般来说就直接是这个，如果质量不好，我肯定会写其他的,5,2018-09-04 12:51:49,妖***莲,金色,3GB+32GB,标准版,来自京东iPhone客户端,PLUS会员
22778,22778, 畅享8,在京东上买的第三台华为了，棒棒的,5,2018-08-06 14:33:53,j***d,金色,4GB+64GB,标准版,来自京东iPhone客户端,金牌会员
22779,22779, 畅享8,不错 给妈妈买的 平时需求不大 就是微信电视什么的 不打游戏 目前没有卡顿 联网也快 赞一个,5,2018-08-05 11:34:37,j***语,金色,3GB+32GB,标准版,来自京东iPhone客户端,金牌会员
22780,22780, 畅享8,东西不错，东西不错，老爸很喜欢。好吧，不知道够20个字了没有，我再数数看看，应该够了吧！,5,2018-09-02 09:04:21,王***妞,金色,3GB+32GB,标准版,来自京东Android客户端,金牌会员
22781,22781, 畅享8,这款手机买给我爸妈用的，屏幕大小适合他们，拍照也挺清晰。可以同时放两个电话卡和一个内存卡。,5,2018-08-17 11:30:10,j***b,金色,3GB+32GB,标准版,来自京东Android客户端,金牌会员
22782,22782, 畅享8,货已收到了，现在正试用呢，机身很美观，好好&hellip;,5,2018-06-06 15:57:58,j***k,粉色,4GB+64GB,标准版,来自京东Android客户端,金牌会员
22783,22783, 畅享8,手机不错，给老丈母娘买的，运营速度可以了，特别是老年人用，足够了，包装不错，还赠送了手机套和耳机，昨晚下单，今天10：45就送到了，京东快递还是非常靠谱的。,5,2018-07-12 10:56:35,我***烦,粉色,4GB+64GB,标准版,来自京东Android客户端,银牌会员
22784,22784, 畅享8,华为手机没得说  一直在用  很好,5,2018-07-16 09:11:36,j***e,黑色,4GB+64GB,标准版,来自京东Android客户端,金牌会员
22785,22785, 畅享8,给老人买的，屏幕大 ，就是用的时间长了有些热，打电话久了发热也挺厉害。,5,2018-08-14 12:07:10,其***坏,金色,3GB+32GB,标准版,来自京东iPhone客户端,PLUS会员
22786,22786, 畅享8,收到以后迫不及待打开看了看整体效果不错马上去挺舒服用起来还可以希望以后不要出现问题。京东快递就是给力当天晚上就送到了而且还下着雨谢谢卖家和快递小哥辛苦了！,5,2018-07-11 21:39:26,稻***嗨,黑色,4GB+64GB,标准版,来自京东iPhone客户端,银牌会员
22787,22787, 畅享8,给老爸买的，还不错,5,2018-06-22 15:40:45,起***粤,金色,4GB+64GB,标准版,来自京东iPhone客户端,PLUS会员
22788,22788, 畅享8,发货超级快，东西很好，贴了膜才拍的,5,2018-07-04 12:11:55,小***7,金色,4GB+64GB,标准版,来自京东Android客户端,铜牌会员
22789,22789, 畅享8,给老爸买的 ，还不错，屏幕大,5,2018-07-31 08:33:00,j***8,黑色,3GB+32GB,标准版,来自京东iPhone客户端,金牌会员
22790,22790, 畅享8,手机屏幕显示像素太低！比我原来的红米Note2多要差多了，其它性能还行！习惯好评！,5,2018-09-10 07:29:03,z***3,金色,3GB+32GB,标准版,来自京东Android客户端,金牌会员
22791,22791, 畅享8,开包装盒后，发现屏幕机身有指纹和轻微灰尘，不像一同购买的荣耀7X那样开箱全新无痕迹，机身背面有个小点掉漆，机器里有下载未安装的软件，有些怀疑是别人退换货的，使用一天没大毛病懒得换了，但心情不太开心，希望京东提供的是新机子对用户负责。,4,2018-07-10 18:47:25,阳***3,蓝色,4GB+64GB,标准版,来自京东Android客户端,金牌会员
22792,22792, 畅享8,手机不错，虽然开后降价了，但是申请了价格保护，华为手机值得拥有,5,2018-09-07 00:32:06,l***8,金色,3GB+32GB,标准版,来自京东iPhone客户端,PLUS会员
22793,22793, 畅享8,京东物流超快，华为手机真的不错,5,2018-07-08 20:03:50,m***l,金色,4GB+64GB,标准版,来自京东Android客户端,金牌会员
22794,22794, 畅享8,买个爸爸的，很满意，对他们来说屏幕大了点，但是像数，速度都很不错，老人家用着开心。,5,2018-08-29 15:05:41,3***1,金色,3GB+32GB,标准版,来自微信购物,银牌会员
22795,22795, 畅享8,屏幕看着很清晰，预安装的不少软件app，不过可以自己卸载掉，现在运行流畅，今天刚开始用，用一段时间再追加评价。暂时5星好评吧,5,2018-08-06 19:18:44,jd_◆ 可口◆,蓝色,3GB+32GB,全网通NFC版,来自京东iPhone客户端,PLUS会员
22796,22796, 畅享8,京东的给我代言费了 - -，亲戚都被我拉到这买！本来都要去实体店的,5,2018-07-21 11:33:43,茗***爸,金色,3GB+32GB,标准版,,PLUS会员
22797,22797, 畅享8,比想象中的轻，感觉还可以吧,5,2018-07-20 13:23:35,一***天,粉色,4GB+64GB,标准版,来自京东Android客户端,银牌会员
22798,22798, 畅享8,因出差才来评价的，入手华为已经10部了，她自主研发的软硬件最多比肩苹果，国际上少有的好品牌，国内其它所为品牌其实就是杂牌组装机！,5,2018-07-02 08:31:14,j***3,蓝色,4GB+64GB,标准版,来自京东Android客户端,PLUS会员
22799,22799, 畅享8,给家里老人买的，之前一直用老人机，现在换智能机了，老人很高兴,5,2018-08-25 18:00:00,z***8,金色,3GB+32GB,标准版,来自京东iPhone客户端,PLUS会员
22800,22800, 畅享8,这款手机不建议大家购买，拿到手机，手机屏幕上连个保护膜都没有，再不用说贴膜，手机像素特别差，手机运行也经常有卡钝感，这是机子本身硬件问题，另外一个就充电超级慢，一次充电得六小时左右，本来我是要退货的，凑巧家里有一些事影响耽误了时间，特糟心！看看下图包装盒就知道啥货了,5,2018-07-28 08:48:55,涉***2,金色,4GB+64GB,标准版,来自京东Android客户端,钻石会员
22801,22801, 畅享8,给爸爸买的 爸爸说用着还行 我用稍微有点慢 但是老年人用足矣,5,2018-08-21 21:44:19,仁***龟,金色,3GB+32GB,标准版,来自京东iPhone客户端,PLUS会员
22802,22802, 畅享8,买了不到一周就降价了，第八天才发现，让我自认倒霉，没有同价位的其他手机好用，有点卡,5,2018-08-01 12:38:14,j***棄,金色,3GB+32GB,标准版,来自京东Android客户端,金牌会员
22803,22803, 畅享8,非常不错的手机，质量很好,5,2018-07-14 20:48:25,杨***0,黑色,4GB+64GB,标准版,来自京东Android客户端,银牌会员
22804,22804, 畅享8,老爸已经用了，不得不说华为的千元机做的很不错，一家长都用的华为品牌，支持国产！,5,2018-08-24 21:37:21,赶***驴,金色,3GB+32GB,标准版,来自京东iPhone客户端,银牌会员
22805,22805, 畅享8,此用户未填写评价内容,5,2018-08-07 19:58:39,j***u,金色,4GB+64GB,标准版,来自京东Android客户端,银牌会员
22806,22806, 畅享8,物流挺快，还没使用用后再评,5,2018-06-26 13:57:40,A***s,金色,4GB+64GB,标准版,来自京东Android客户端,银牌会员
22807,22807, 畅享8,不错，已经用上了，老爸很喜欢！如果能送贴膜或者再优惠点就完美了,5,2018-07-23 23:42:15,j***1,金色,3GB+32GB,标准版,来自京东Android客户端,PLUS会员
22808,22808, 畅享8,华为手机真心不错   已经是第三部了  反应速度   拍照效果杠杠滴  京东服务也非常不错   送货上门 速度也非常快   非常满意的一次购物,5,2018-07-26 15:55:32,j***f,金色,4GB+64GB,标准版,来自京东Android客户端,铜牌会员
22809,22809, 畅享8,不到24小时就拿到手上了，物流相当给力，包装也很坚固严实，手机颜色很淡雅，送了水晶套和耳机，看起来不错！很成功的一次网购！,5,2018-07-21 15:07:15,n***1,粉色,4GB+64GB,标准版,来自京东iPhone客户端,PLUS会员
22810,22810, 畅享8,机子不错，支持国货。,5,2018-07-27 16:44:46,j***k,金色,4GB+64GB,标准版,来自京东Android客户端,银牌会员
22811,22811, 畅享8,挺好的，发货速度快，,5,2018-07-25 14:18:59,g***1,金色,4GB+64GB,标准版,来自京东Android客户端,金牌会员
22812,22812, 畅享8,用着挺好的，给女朋友她爸买的，感觉很是不错。活动买的也很实惠。,5,2018-07-12 15:42:37,枏***枏,金色,3GB+32GB,标准版,来自京东iPhone客户端,PLUS会员
22813,22813, 畅享8,有点卡，我下的东西不多可是机子有时候就黑屏了，不明白是什么原因，心情复杂,5,2018-09-16 20:41:49,j***P,金色,3GB+32GB,标准版,来自微信购物,铜牌会员
22814,22814, 畅享8,帮我爸买的。他说很喜欢。,5,2018-06-23 13:52:04,j***9,金色,4GB+64GB,标准版,来自京东Android客户端,银牌会员
22815,22815, 畅享8,颜色太漂亮了，给妈妈买的，她好喜欢，老妈七十五了也赶赶时髦，功能很多但是她也用不上，玩玩小游戏还是很好的，手机没发烫，用后再来评效果怎么样！,5,2018-07-17 09:11:29,j***女,蓝色,4GB+64GB,标准版,来自京东Android客户端,银牌会员
22816,22816, 畅享8,物流很给力，东西是正品，很好用，屏也很大，给五颗星，值得购买。,5,2018-07-01 10:49:41,h***5,金色,3GB+32GB,标准版,来自京东Android客户端,PLUS会员
22817,22817, 畅享8,此用户未填写评价内容,5,2018-07-04 13:31:07,j***川,粉色,4GB+64GB,标准版,来自京东Android客户端,钻石会员
22818,22818, 畅享8,帮父母买的手机，速度挺快老人用用正好。京东物流没话说。,5,2018-08-15 12:44:34,b***o,金色,3GB+32GB,标准版,来自京东iPhone客户端,钻石会员
22819,22819, 畅享8,价格实惠，性能也可以，屏幕是六寸细长比例，开始的时候不习惯，有些App不能全屏显示,5,2018-06-20 08:47:30,y***6,金色,3GB+32GB,标准版,,钻石会员
22820,22820, 畅享8,买给我妈的，她就用来打打电话，看看视频，差不多了,5,2018-09-18 03:29:18,_***_,金色,3GB+32GB,标准版,来自京东Android客户端,PLUS会员
22821,22821, 畅享8,跟我想象中一样好用,5,2018-07-24 07:28:55,P***X,金色,4GB+64GB,标准版,来自微信购物,银牌会员
22822,22822, 畅享8,好，和实体店一样。,5,2018-07-18 11:25:44,科***兰,蓝色,4GB+64GB,标准版,来自京东Android客户端,金牌会员
22823,22823, 畅享8,包装完整，是正品，蓝色外观还不错，儿子喜欢！主要是学习用，速度快，电池够用！自带手机壳，但是没有手机膜，需要另买！,5,2018-07-24 21:48:41,x***7,蓝色,4GB+64GB,标准版,来自京东Android客户端,PLUS会员
22824,22824, 畅享8,手机挺好，很流畅！,5,2018-07-07 10:53:51,纵***1,金色,3GB+32GB,全网通NFC版,来自京东Android客户端,银牌会员
22825,22825, 畅享8,买来送父母的，华为手机功能比较齐全支持国产，大爱！,5,2018-08-13 13:30:43,萍***人,金色,3GB+32GB,标准版,来自京东iPhone客户端,PLUS会员
22826,22826, 畅享8,好用，喜欢，是正品,5,2018-07-01 20:02:08,t***6,粉色,4GB+64GB,标准版,来自京东Android客户端,钻石会员
22827,22827, 畅享8,买家电一直信赖京东,5,2018-06-23 16:04:55,jd_159396ota,黑色,4GB+64GB,标准版,来自京东Android客户端,金牌会员
22828,22828, 畅享8,手机收到了，给家里老人买的，挺好的，后期再追加评价,5,2018-08-01 12:21:51,j***灵,金色,3GB+32GB,标准版,来自京东Android客户端,PLUS会员
22829,22829, 畅享8,给家里老人买的，用起来很流畅，设置也方便，好评！,5,2018-08-12 16:47:44,z***8,金色,3GB+32GB,标准版,来自京东iPhone客户端,PLUS会员
22830,22830, 畅享8,手机不错，虽然开后降价了，但是申请了价格保护,5,2018-09-07 00:31:29,l***8,金色,3GB+32GB,标准版,来自京东iPhone客户端,PLUS会员
22831,22831, 畅享8,给老爸买的，老人家很高兴，就是桌面上的app图标太小，其他都不错。,5,2018-08-23 19:47:11,1***p,金色,3GB+32GB,标准版,来自京东iPhone客户端,金牌会员
22832,22832, 畅享8,送给老人的，自己没有用不知道怎么样，老人家很满意。,5,2018-07-24 11:51:35,z***a,金色,3GB+32GB,标准版,来自京东Android客户端,PLUS会员
22833,22833, 畅享8,很好。地址是我婆婆这破地哦这会赔你跟我说是我婆婆关注一下我在，呢子破后花园,5,2018-06-23 22:29:50,j***6,金色,3GB+32GB,标准版,来自京东iPhone客户端,银牌会员
22834,22834, 畅享8,华为的忠实粉丝，这款手机性价比很高，在京东下单，次日到达，还有礼品送，昨晚在网上鉴定为正品，经过今天试用，速度快，相片清晰.,5,2018-04-12 16:54:18,H***5,黑色,4GB+64GB,标准版,,钻石会员
22835,22835, 畅享8,还不错，买给妈妈的，用着也顺手 。这个价格超值的，物流是一直的快。,5,2018-08-18 10:27:27,m***3,金色,3GB+32GB,标准版,来自京东Android客户端,银牌会员
22836,22836, 畅享8,手机等了好久！本来19就应该送到的，但是多等了三四天！不过手机真心很不错，很便宜，运行不错，很轻，屏幕很大，这个价格这个硬件很不错的。,5,2018-06-24 21:48:54,W***r,黑色,3GB+32GB,标准版,来自京东iPhone客户端,金牌会员
