,Unnamed: 0,model,content,score,creationTime,nickname,productColor,productSales,productSize,userClientShow,userLevelName
22609,22609, 畅享8,超级快哦，很不错，给爸爸妈妈一人买了一台，价格不高，功能她们用刚刚好，大小也合适，屏幕没有太大，反正爸妈都是两个手拿哈哈，赞赞赞,5,2018-08-06 15:58:11,一***了,蓝色,4GB+64GB,标准版,来自京东Android客户端,金牌会员
22610,22610, 畅享8,此用户未填写评价内容,5,2018-07-18 12:32:12,j***m,粉色,4GB+64GB,标准版,来自京东Android客户端,铜牌会员
22611,22611, 畅享8,此用户未填写评价内容,5,2018-07-26 10:43:26,j***e,金色,4GB+64GB,标准版,来自京东Android客户端,铜牌会员
22612,22612, 畅享8,很薄，，比想像中的要好，，超乎我想象，，，，，手机电很耐用，，我是个手机控，，哦几乎离不开手机，，但一天只用冲一次电，，，，，，太赞?了，，，手机速度很流畅，，，，，手势拍照很好用，，，手一抬就拍了，，，玩游戏一点也不卡，，，，大爱，，，，外观漂亮。。。。高大时尚上层次，，，，，，，，，，，， 这款手机?真的超级棒，，，第一次在网上买手机，，，开始还有点当心是假的?。，，拿回来以后真的超乎想象，，太赞了太赞了太赞了太赞了，，，，，，，大爱大爱大爱大爱啊有颜值有质量，，，，，，，，，非常完美！！！！！！！！,5,2018-07-04 09:22:47,k***n,金色,4GB+64GB,标准版,,银牌会员
22613,22613, 畅享8,手机还行很好，物理也很快，快递员太度不好，我只说了一句，我要打开包装看，他就把快递拿走了，说叫我在买在次下单，第二次我没敢说打开看，怕他把快递又拿走了，就只有给了钱，拿回来才发现他把我快递甩了，合子都甩出伤了，我这两天想不通，所以我评价有图片,5,2018-07-26 20:44:37,j***d,金色,4GB+64GB,标准版,来自微信购物,银牌会员
22614,22614, 畅享8,头天晚上八点多九点下单，第二天中午就收到了，不愧是京东物流，手机是挺好的，就是没有送钢化膜哪些，收到了都不能用，买的钢化膜还没到??,5,2018-07-25 21:34:56,蛋***7,粉色,4GB+64GB,标准版,来自京东iPhone客户端,银牌会员
22615,22615, 畅享8,外观漂亮，屏幕很大，屏幕显示很清晰，系统很流畅，非常的满意，性价比很高。运行速度也比较快！希望后期能一如既往！,5,2018-06-24 15:32:37,g***j,黑色,4GB+64GB,标准版,来自京东iPhone客户端,PLUS会员
22616,22616, 畅享8,还挺好，买给老人用的，活动优惠，屏幕大的，系统流畅,5,2018-08-27 16:44:40,长***子,金色,3GB+32GB,标准版,来自京东Android客户端,PLUS会员
22617,22617, 畅享8,老妈很喜欢，光玩微信和一般小游戏足够，价格也可以轻松接受,5,2018-07-06 09:33:45,丛***边,金色,3GB+32GB,标准版,来自京东Android客户端,PLUS会员
22618,22618, 畅享8,挺好的，给爸爸买的，老人用绝对够用了，已经在京东买了好几个手机了，都很好。,5,2018-07-09 17:37:24,j***7,金色,3GB+32GB,标准版,来自京东iPhone客户端,钻石会员
22619,22619, 畅享8,超级快哦，很不错，给爸爸妈妈一人买了一台，价格不高，功能她们用刚刚好，大小也合适，屏幕没有太大，反正爸妈都是两个手拿哈哈，赞赞赞,5,2018-08-06 15:58:28,一***了,粉色,4GB+64GB,标准版,来自京东Android客户端,金牌会员
22620,22620, 畅享8,华为的质量算是不错的，CPU算是骁龙最垃圾的了，主要看中外观了，拍照还凑乎，日常不玩游戏够用，玩游戏慎重选择,5,2018-08-03 09:28:51,神***论,粉色,4GB+64GB,标准版,来自京东iPhone客户端,PLUS会员
22621,22621, 畅享8,挺好的 屏幕清晰 我们单位全是华为 国产的骄傲 这是帮朋友买的 我的meta10 同事P10 荣耀系列 好几个,5,2018-07-19 18:53:24,狂***天,黑色,4GB+64GB,标准版,来自京东Android客户端,PLUS会员
22622,22622, 畅享8,原先手机丢失，买个手机准备过渡一下，现在手机找到了，所以感觉有点多余了，没拆封，又不好退，1299砸手里了！有没有朋友~我,5,2018-07-15 09:19:58,j***5,黑色,4GB+64GB,标准版,来自京东iPhone客户端,铜牌会员
22623,22623, 畅享8,快递非常给力，昨天晚上下单，今天上午到货，这个机器性价比比较高，使用非常顺畅，很适合年纪大的人。手感非常棒，黑色经典。,5,2018-06-25 10:00:49,j***u,黑色,4GB+64GB,标准版,来自京东iPhone客户端,PLUS会员
22624,22624, 畅享8,买给老妈用的，价格配置都非常合适！华为是国产机中不错的品牌了！,5,2018-04-12 11:43:18,j***1,金色,3GB+32GB,标准版,来自京东iPhone客户端,PLUS会员
22625,22625, 畅享8,目前来说手机挺好用的，没什么卡顿，还算流畅，给我妈买的，很适合她。,5,2018-07-30 21:45:55,C***r,金色,3GB+32GB,标准版,来自京东Android客户端,银牌会员
22626,22626, 畅享8,反应慢了点，功夫长了手机后面有点发烫。,5,2018-09-13 19:22:27,j***a,金色,3GB+32GB,标准版,来自京东Android客户端,PLUS会员
22627,22627, 畅享8,手机收到了，看着挺好！给老人买的实惠最主要,5,2018-08-15 16:59:53,一***户,金色,3GB+32GB,标准版,来自京东iPhone客户端,PLUS会员
22628,22628, 畅享8,华为手机?不错，目前运行速度挺快的，大小适合拿在手中玩耍，画面比较清晰，声音在大点就好了！送的耳机?挺不错，赞?一个！,5,2018-08-02 10:24:45,z***8,金色,4GB+64GB,标准版,来自京东Android客户端,金牌会员
22629,22629, 畅享8,帮邻居老头买的，非要大容量手机，比我用的配置还高，到手乐呵的，目前没毛病，手机选京东自营店，可以信赖。但是你价格比其他店贵了呢,5,2018-07-27 17:57:17,左***1,蓝色,4GB+64GB,标准版,来自京东Android客户端,银牌会员
22630,22630, 畅享8,挺好的，用着好，声音清晰，不错，值得购买的，以后坏了继续购买,5,2018-08-23 14:53:05,j***p,金色,3GB+32GB,标准版,来自京东iPhone客户端,金牌会员
22631,22631, 畅享8,使了一段时间了才来评价，手机，很好很好用，速度也还可以。,5,2018-09-17 23:10:45,y***4,金色,3GB+32GB,标准版,来自京东iPhone客户端,金牌会员
22632,22632, 畅享8,京东自营产品质量安全可靠，京东物流超给力！,5,2018-05-28 10:29:49,z***n,金色,3GB+32GB,标准版,来自京东iPhone客户端,PLUS会员
22633,22633, 畅享8,京东618买的。香槟色，配上一个香槟色手机壳，就非常漂亮。试用了几天，电很经用，2天没有问题。系统也很流畅。,5,2018-06-25 00:29:38,戴***尔,金色,4GB+64GB,标准版,来自京东iPhone客户端,PLUS会员
22634,22634, 畅享8,可以,5,2018-08-06 10:21:50,d***0,金色,3GB+32GB,标准版,来自京东Android客户端,银牌会员
22635,22635, 畅享8,京东物流一如既往的好。早上下的单。下午5点就到了。手机质感很不错。这个价位性价比真心高。给老妈买的老妈很喜欢。很愉快的一次购物,5,2018-06-24 18:38:04,张***5,金色,4GB+64GB,标准版,来自京东iPhone客户端,银牌会员
22636,22636, 畅享8,手机卖给妈妈的，她很喜欢。华为手机值得拥有，没让我失望,5,2018-08-30 12:33:50,j***s,金色,3GB+32GB,标准版,来自京东Android客户端,银牌会员
22637,22637, 畅享8,华为大品牌值得信赖，一直用的华为手机，支持国产，价格优惠，功能强大，性能优越，值得拥有！一直在京东买手机，品质有保证！,5,2018-07-31 12:41:02,1***p,黑色,4GB+64GB,标准版,来自京东Android客户端,金牌会员
22638,22638, 畅享8,京东发货越来越快了，小城市也能当天到了。,5,2018-07-03 17:17:03,t***i,金色,3GB+32GB,标准版,来自京东Android客户端,PLUS会员
22639,22639, 畅享8,给妈妈买的，妈妈很喜欢，用着也很好,5,2018-08-09 19:42:36,j***f,金色,3GB+32GB,标准版,来自京东iPhone客户端,PLUS会员
22640,22640, 畅享8,给老妈买来用的还可以吧 不评价的本来,5,2018-07-23 16:41:07,良***家,金色,3GB+32GB,标准版,来自京东Android客户端,PLUS会员
22641,22641, 畅享8,买给老妈用的，老妈很喜欢，相比于原来的畅享5，这个太好用了，无论是照相还是反应速度，老妈很满意！,5,2018-07-21 20:06:51,小***空,金色,4GB+64GB,标准版,来自京东Android客户端,PLUS会员
22642,22642, 畅享8,非常好看 ，喜欢，试拍了一下效果不错，值得购买的一款手机 ，赞一下?,5,2018-04-05 11:43:46,乐乐747,金色,4GB+64GB,标准版,来自京东Android客户端,金牌会员
22643,22643, 畅享8,刚开机看着不错，纤薄流畅，给婆婆买的希望待机可以久点,5,2018-07-24 12:59:42,拈***1,金色,3GB+32GB,标准版,来自京东iPhone客户端,钻石会员
22644,22644, 畅享8,帮朋友买的，做工很好，颜色很漂亮，工作也很满意，速度很快非常超值，华为的东西就是好，下次还会再买,5,2018-06-25 18:27:04,z***6,粉色,4GB+64GB,标准版,来自京东Android客户端,PLUS会员
22645,22645, 畅享8,支持国货，很好的。也很流畅，给家人买的，声音有点点偏小声,5,2018-06-23 20:49:51,小***浪,金色,3GB+32GB,标准版,来自京东iPhone客户端,金牌会员
22646,22646, 畅享8,可以嘛。。。。学生用还不错,5,2018-08-19 13:13:28,寂***远,金色,3GB+32GB,标准版,来自京东Android客户端,PLUS会员
22647,22647, 畅享8,外观很漂亮，字体和声音都能调得很大，适合爸妈用,5,2018-08-15 14:51:18,z***s,金色,3GB+32GB,标准版,来自京东iPhone客户端,金牌会员
22648,22648, 畅享8,自带程序太多，不知道是不是正品机，用用再来评论,5,2018-08-08 08:02:59,j***p,金色,3GB+32GB,标准版,来自京东Android客户端,金牌会员
22649,22649, 畅享8,&nbsp;产品是第1次购买，不知道如何，希望好用。发货速度快，因为是京东快递直送，送货上门，很方便。但是这次性价比好，一如既往的支持，很好。,5,2018-08-30 23:50:17,想***灵,金色,3GB+32GB,标准版,来自京东Android客户端,PLUS会员
22650,22650, 畅享8,手机不错，屏幕很大，操作起来也很流畅，手感也很棒，关键这个颜色也是美腻的不行，家人很喜欢。,5,2018-06-24 00:55:20,谢***岗,蓝色,4GB+64GB,标准版,来自京东Android客户端,PLUS会员
22651,22651, 畅享8,非常好送货很快，手机也很好.给老妈买的她很喜欢,5,2018-07-18 10:47:19,j***y,金色,3GB+32GB,标准版,来自京东iPhone客户端,银牌会员
22652,22652, 畅享8,给妈妈买的，很满意，划算，看起来很高档,5,2018-09-11 13:59:15,敏***3,金色,3GB+32GB,标准版,来自京东iPhone客户端,银牌会员
22653,22653, 畅享8,商品以收到商家服务一流快递公司服务热情快递员服务热情给五星好评第二次买了手质量好谢谢,5,2018-07-24 14:04:49,j***f,金色,4GB+64GB,标准版,来自京东Android客户端,PLUS会员
22654,22654, 畅享8,质量蛮好，京东自营很好的，很喜欢。就是之前本来想买屏险的，结果手机还没送过来丢在社区服务点 我还没签收，也没接到京东快递电话，就说我已经签收，结果买不了。遗憾,5,2018-08-31 17:03:03,j***r,金色,3GB+32GB,标准版,来自京东Android客户端,钻石会员
22655,22655, 畅享8,包装不错包装不错包装不错包装不错,5,2018-06-29 09:34:18,j***7,金色,3GB+32GB,标准版,,PLUS会员
22656,22656, 畅享8,下载了一个斗地主，竟然卡返回不去。习惯好评。,5,2018-08-06 14:04:16,C***3,金色,3GB+32GB,标准版,来自京东Android客户端,银牌会员
22657,22657, 畅享8,此用户未填写评价内容,5,2018-08-14 10:17:29,j***x,金色,3GB+32GB,标准版,来自京东Android客户端,PLUS会员
22658,22658, 畅享8,这个价格还是很划算的。经济实惠，物美价廉，质量非常好，跟卖家描述的完全一致。非常满意，完全超出期望值，超级划算，性价比高，购物比实体店便宜多了，很满意的一次网购。希望卖家生意越来越兴隆，物流也很快，包装很结实。六星好评，多一星不怕你骄傲，还在犹豫的朋友赶紧下手，良心推荐，真的很不错，性价比也很高，以后还在这家买。给三个好评，满意！满意！满意！,5,2018-07-30 12:54:29,以***来,黑色,4GB+64GB,标准版,来自京东iPhone客户端,银牌会员
22659,22659, 畅享8,运行速度可以，性价比还可以，给老妈买的，就是铃声再大点就好了，整体不错。,5,2018-07-11 17:24:57,1***6,粉色,3GB+32GB,标准版,来自京东iPhone客户端,PLUS会员
22660,22660, 畅享8,中间换货了一次，因为屏幕下面部分亮度偏暗，还比较严重。换货过程还比较顺利，但是换过来的新手机还是有点老问题，不过没那么严重。总体来说还可以吧，不太纠结就行。,5,2018-08-16 17:14:46,j***s,金色,3GB+32GB,标准版,来自京东iPhone客户端,金牌会员
22661,22661, 畅享8,昨晚下的单，今天上午就收到了，京东物流就是快，手机很漂亮，用了一下很满意一如既往的支持国货支持京东！,5,2018-07-15 22:01:08,纤***幽,金色,4GB+64GB,标准版,来自京东Android客户端,银牌会员
22662,22662, 畅享8,外观设计风格很喜欢。配置上很好很强。手机外壳有些掉价了。今天刚刚收到。用几天看看，好用再来一个。,5,2018-07-27 22:43:03,浩***乾,金色,4GB+64GB,标准版,来自京东iPhone客户端,银牌会员
22663,22663, 畅享8,今天下单，今天到手，京东物流太牛，手感不错，后续继续评价，总的来说，很满意！,5,2018-07-25 22:40:07,詹***0,金色,4GB+64GB,标准版,来自京东iPhone客户端,PLUS会员
22664,22664, 畅享8,手机挺大的，跟想象中的差不多，反应也快，就是开机速度不怎么样。总体来说挺好的，快递员服务态度很好,5,2018-07-19 09:34:09,浅***语,粉色,4GB+64GB,标准版,来自京东Android客户端,银牌会员
22665,22665, 畅享8,华为手机大品牌，值得信赖。这些年一直在京东商城上买东西，货真价实，服务态度好。送货员服务态度也好。,5,2018-06-23 15:14:44,j***u,金色,4GB+64GB,标准版,来自京东Android客户端,银牌会员
22666,22666, 畅享8,"618买的。收货很快 给婆婆买的手机 很喜欢 用着还不错哦
也是同学推荐的型号 说是比其他的好",5,2018-07-22 18:13:43,b***1,金色,4GB+64GB,标准版,来自京东Android客户端,金牌会员
22667,22667, 畅享8,性价比还是很高的，用于公司工程上使用，非常方便，关键是快，唯有快才能保持优势，京东这方面做的还是很不错的，送货员也不错，值得表扬。,5,2018-08-13 09:12:15,轩***5,金色,3GB+32GB,标准版,,PLUS会员
22668,22668, 畅享8,看上去还不错，买手机?一直买京东商城滴，感觉放心吧?快递很快的，服务也不错?先好评吧,5,2018-08-04 06:57:05,j***2,蓝色,4GB+64GB,标准版,来自京东Android客户端,银牌会员
22669,22669, 畅享8,挺好的 弟弟打游戏不卡 他挺喜欢的,5,2018-06-25 19:53:33,j***v,金色,3GB+32GB,标准版,来自京东iPhone客户端,金牌会员
22670,22670, 畅享8,不太好，后悔了。没手感，大又轻,5,2018-07-11 14:44:43,陈***清,金色,3GB+32GB,标准版,来自京东iPhone客户端,银牌会员
22671,22671, 畅享8,还不错反应挺快，外观好看,5,2018-08-11 18:18:53,l***4,金色,3GB+32GB,标准版,来自京东Android客户端,银牌会员
22672,22672, 畅享8,华为畅享8这款手机很好，买的时候看评价说声音小，特地听了音乐声音不小。反映快做工也很不错配置也高，还有人脸识别，还送了耳机。京东快递也很给力，头天下单第二天就到了。千元机的价位有这样的算不错了，全五星好评。,5,2018-08-07 12:42:02,o***V,金色,4GB+64GB,标准版,来自京东Android客户端,银牌会员
22673,22673, 畅享8,京东就是快，质量信得过，我在京东买的第十台机了，送给老婆的生日礼物。谢谢,5,2018-06-12 20:36:21,j***c,粉色,4GB+64GB,标准版,来自京东Android客户端,PLUS会员
22674,22674, 畅享8,挺好用的，这个价位很值,5,2018-08-12 12:26:37,j***a,金色,3GB+32GB,标准版,来自京东iPhone客户端,银牌会员
22675,22675, 畅享8,很漂亮的一款手机，耳机，手机套都有送，不知道有得送，我还顺便另外一起下单购买了一个手机套,5,2018-07-11 18:49:16,j***b,粉色,4GB+64GB,标准版,来自京东Android客户端,金牌会员
22676,22676, 畅享8,手机好不错，上午下单下午就用上了，比自己去买还快，手机用上了，可惜，自己的手机不能拍手机，晒不了手机了。,5,2018-03-30 20:27:15,这***m,金色,4GB+64GB,标准版,来自京东Android客户端,PLUS会员
22677,22677, 畅享8,此用户未填写评价内容,5,2018-08-30 19:44:37,j***c,金色,3GB+32GB,标准版,来自京东Android客户端,银牌会员
22678,22678, 畅享8,此用户未填写评价内容,5,2018-08-28 20:46:25,j***l,金色,3GB+32GB,标准版,来自京东iPhone客户端,银牌会员
22679,22679, 畅享8,此用户未填写评价内容,5,2018-08-19 13:03:26,过***0,金色,3GB+32GB,标准版,来自京东iPhone客户端,钻石会员
22680,22680, 畅享8,刚收到，还没用。看这不错。也比较喜欢。为快递小哥点赞，顶着台风，冒着大雨。速度还快。,5,2018-07-22 10:13:18,j***f,金色,4GB+64GB,标准版,来自京东Android客户端,金牌会员
22681,22681, 畅享8,此用户未填写评价内容,5,2018-08-15 18:47:52,j***p,金色,3GB+32GB,标准版,来自京东Android客户端,铜牌会员
22682,22682, 畅享8,非常好用，特别京东自营售后无忧，见意大家买京东自营商品。****，退换货足不出户。,5,2018-07-29 12:26:49,j***8,蓝色,4GB+64GB,标准版,来自京东Android客户端,银牌会员
22683,22683, 畅享8,手机收到，很漂亮，很稀饭。支持京东，自营送货速度很快，上午下单，下午收货，棒棒哒！,5,2018-07-18 17:42:50,j***s,粉色,4GB+64GB,标准版,来自京东Android客户端,银牌会员
22684,22684, 畅享8,还行，运行比较流畅，反应速度快，自带软件很多，删除不了，包装简单，就用一袋子装着手机,5,2018-07-04 18:50:14,j***a,黑色,4GB+64GB,标准版,来自京东Android客户端,金牌会员
22685,22685, 畅享8,下单前说是隔天到达，下单后是三天后，还真是没谁了！外包装不是华为原厂包装，而是京东的,5,2018-07-02 08:15:43,张***音,蓝色,4GB+64GB,标准版,来自京东iPhone客户端,金牌会员
22686,22686, 畅享8,手机不错全新。,5,2018-08-04 10:43:29,s***0,黑色,4GB+64GB,标准版,来自京东iPhone客户端,钻石会员
22687,22687, 畅享8,还可以，手感不错，用了两天，没啥问题，一次性买了两个，送父母的，他们都很喜欢，手机也暂时没啥问题，指纹锁很快，希望保持下去,5,2018-07-22 08:18:07,j***j,金色,3GB+32GB,标准版,来自京东Android客户端,PLUS会员
22688,22688, 畅享8,家人很喜欢，电池耐用。,5,2018-07-15 13:17:43,终***7,金色,3GB+32GB,标准版,来自京东Android客户端,钻石会员
22689,22689, 畅享8,货运比较快，晚上定，第二天中午以前到，质量用了才评价，样式大小挺适合的。,5,2018-07-11 10:47:37,j***5,金色,4GB+64GB,标准版,来自京东Android客户端,银牌会员
22690,22690, 畅享8,这款手机帮同学选的，很高兴选对了，价格便宜外观超好看，配置也不错，拿到手感觉第一眼惊艳到了，还送了耳机和软件手机壳，舍友买的苹果都没这些赠品呢，还是华为的牌子好。外加一句快递员的态度很好，京东一天就到了。,5,2018-07-06 12:45:01,m***蛋,蓝色,4GB+64GB,标准版,来自京东Android客户端,银牌会员
22691,22691, 畅享8,真不错，京东发货很快很放心。这个暑假没干别的，就买了两部华为畅想8，真的很好。,5,2018-08-06 13:26:38,灰太狼的师娘,粉色,4GB+64GB,标准版,来自京东Android客户端,金牌会员
22692,22692, 畅享8,还是很不错的，大 屏手感 好，系统速度也挺快，价格实惠。指纹解锁功能特别方便。,5,2018-08-04 08:33:29,蕾***鼻,蓝色,4GB+64GB,标准版,,银牌会员
22693,22693, 畅享8,挺好的，给妈妈买的挺适合,5,2018-07-06 12:52:08,j***v,金色,3GB+32GB,标准版,来自京东iPhone客户端,金牌会员
22694,22694, 畅享8,京东自营值得信赖，正品保证，华为手机性价比很高，支持国货，屏幕大，但机身轻便，牛,5,2018-07-28 20:48:46,w***f,粉色,4GB+64GB,标准版,来自京东iPhone客户端,钻石会员
22695,22695, 畅享8,很好，上次刚给我妈买了还不到一个月就被小偷偷了，这次还买一个一样的，大屏幕，质量好！,5,2018-06-29 20:33:11,l***e,黑色,4GB+64GB,标准版,来自京东iPhone客户端,钻石会员
22696,22696, 畅享8,昨天下单，今早就收到了。手机样式好，是我想要的，颜色机型都不错，用上一段再评。,5,2018-08-08 11:08:24,j***o,黑色,4GB+64GB,标准版,来自京东Android客户端,金牌会员
22697,22697, 畅享8,此用户未填写评价内容,5,2018-07-20 09:10:37,j***e,金色,3GB+32GB,标准版,来自京东iPhone客户端,铜牌会员
22698,22698, 畅享8,手机拍照好看，机身也很漂亮，还送了耳机，用了一星期了，没出现什么卡顿现象，支持国产！,5,2018-06-22 15:30:10,j***4,粉色,4GB+64GB,标准版,来自京东Android客户端,铜牌会员
22699,22699, 畅享8,外观，屏幕，手感都感觉不错，华为，支持中国制造！给五星好评，物流快，服务态度好。,5,2018-07-04 22:55:29,尘***成,蓝色,4GB+64GB,标准版,来自京东Android客户端,金牌会员
22700,22700, 畅享8,此用户未填写评价内容,5,2018-06-29 15:32:25,S***n,金色,3GB+32GB,标准版,来自京东iPhone客户端,铜牌会员
22701,22701, 畅享8,物流真的是快，打开手机还描述的一样，手感非常好，还没有用，等用了在追加评论,5,2018-08-04 15:29:55,刘***8,金色,4GB+64GB,标准版,来自京东Android客户端,银牌会员
22702,22702, 畅享8,买给妈妈的，粉色好漂亮！屏幕够大，主要是妈妈非常喜欢，我也很高兴!,5,2018-05-08 19:25:52,E***i,粉色,4GB+64GB,标准版,来自京东Android客户端,PLUS会员
22703,22703, 畅享8,"货已收到，感觉还不错，遗憾的是没有贴膜，习惯好评，
用了在追加评论。",5,2018-07-02 18:42:21,M***N,黑色,3GB+32GB,全网通NFC版,来自京东Android客户端,银牌会员
22704,22704, 畅享8,简直无语这个手机，居然扣费那么严重，都不知道评价是怎么出来的，刚安装的卡，居然100的费用出去了，谁能帮我解释一下，这是为什么？,5,2018-09-12 19:50:56,艾***划,金色,3GB+32GB,标准版,来自京东Android客户端,银牌会员
22705,22705, 畅享8,颜值棒棒的，就是其他方面希望也有惊喜呀。大叔买给阿姨的手机，很少女心，哈哈哈,5,2018-07-16 16:53:16,3***a,粉色,4GB+64GB,标准版,来自京东iPhone客户端,银牌会员
22706,22706, 畅享8,帮同事买的，希望好用，哦哦哦噢噢噢哦哦哦哦哦噢噢噢哦哦,5,2018-07-20 21:35:04,k***9,黑色,4GB+64GB,标准版,来自京东Android客户端,PLUS会员
22707,22707, 畅享8,给孩子买的，使用了两天下来，觉得还可以，暂时没有卡的现象,5,2018-06-28 00:39:22,海***飞,金色,4GB+64GB,标准版,来自京东Android客户端,PLUS会员
22708,22708, 畅享8,宝宝我收到，手机停精致，我很喜欢，快递停快，快递小哥太度停好，五星好平。,5,2018-07-24 09:20:38,j***7,蓝色,4GB+64GB,标准版,来自京东Android客户端,铜牌会员
22709,22709, 畅享8,手机?不错，外观大气时向，反应也挺快的。很喜欢，唯一不足就是电量耗的太快了，而且还没有快充功能千元机配个快充的功能应该不是问题！！！要是能改进就好了。支持国产，但是不足的地方还是希望能改善。,5,2018-08-01 10:23:27,j***c,蓝色,4GB+64GB,标准版,来自京东Android客户端,金牌会员
22710,22710, 畅享8,手机不错，给老人用，华为的手机性价比还是比较高的。,5,2018-08-03 18:52:10,5***D,粉色,4GB+64GB,标准版,来自京东iPhone客户端,PLUS会员
22711,22711, 畅享8,帮同事买的，他说很不错，性价比高，质量可靠，这也是我选择华为的理由?,5,2018-07-31 16:28:17,風***猪,黑色,4GB+64GB,标准版,来自京东Android客户端,钻石会员
22712,22712, 畅享8,挺不错的，屏幕超大清楚，功能多，给妈妈买的，再也不用担心看不清楚字了。,5,2018-07-18 08:20:12,j***p,金色,4GB+64GB,标准版,来自京东iPhone客户端,银牌会员
22713,22713, 畅享8,商品包装很好，正版手机，物流也很快，给个好评，手机手感不错，反应也快,5,2018-07-09 08:21:49,j***m,粉色,4GB+64GB,标准版,来自京东Android客户端,金牌会员
22714,22714, 畅享8,手机非常的满意，外观漂亮大气，运行速度非常的快,5,2018-07-18 07:25:38,j***3,金色,4GB+64GB,标准版,来自京东Android客户端,PLUS会员
22715,22715, 畅享8,京东物流真给力，手机用着特好，信号和网络都是满格，支持国货，值得购买,5,2018-06-28 07:12:34,樱***7,蓝色,4GB+64GB,标准版,来自京东Android客户端,金牌会员
