,Unnamed: 0,model,content,score,creationTime,nickname,productColor,productSales,productSize,userClientShow,userLevelName
22509,22509, 畅享8,京东现在的发货速度真是牛?，头天晚上下单，第二天中午就到了，发票也收到了，用了几天来评价一下，首先外观很漂亮，屏幕够大，蓝色后壳也很漂亮个性，人脸识别功能很好用，再说机子个人和之前用的畅玩6x  4g+ 32g感觉差不多，运行有点慢，不过这个价格估计都是这样的水平吧?，平时不打游戏只是微信    照相和一些app基本也都可以用了！总体性价比高，大家买给妈妈爸爸也不错?，京东价格不稳定，,5,2018-08-04 17:54:21,j***3,蓝色,4GB+64GB,标准版,来自京东Android客户端,钻石会员
22510,22510, 畅享8,给母亲买的，屏幕够大，拍照很清晰，物流最给力，以后自己也换华为，家人很喜欢，超薄手感好,5,2018-05-18 20:44:30,j***8,金色,3GB+32GB,标准版,来自京东iPhone客户端,钻石会员
22511,22511, 畅享8,"一次买了两个，还不错。喜欢。希望用很久
给公司业务员配备的",5,2018-07-15 14:03:26,E***s,金色,3GB+32GB,标准版,来自京东iPhone客户端,PLUS会员
22512,22512, 畅享8,给妈妈买的手机，屏大适合老年人，电池也蛮经用的，关键性价比高，满意！,5,2018-07-13 08:46:53,b***W,金色,3GB+32GB,标准版,来自京东Android客户端,银牌会员
22513,22513, 畅享8,手机到货真快，头天晚上快凌晨下单，第二天中午就送到了，京东配送速度给力哈，老公手机坏了，立马给他拍一部，先过度一下，哈哈，机器还不错，性能不用说大家也都知道的，手感不错，用着顺手，关键价格合理，不再追苹果了?，支持国产华为！???,5,2018-06-28 08:05:07,咖***6,金色,4GB+64GB,标准版,来自京东Android客户端,银牌会员
22514,22514, 畅享8,非常好的东东哦，物流也非常快，满意度很高,5,2018-07-18 22:02:28,j***q,金色,3GB+32GB,标准版,来自京东Android客户端,金牌会员
22515,22515, 畅享8,此用户未填写评价内容,5,2018-04-17 13:07:21,春天看花去,金色,3GB+32GB,标准版,来自京东iPhone客户端,钻石会员
22516,22516, 畅享8,京东物流速度没的说 第二天就到了 包装完好无破损 盒子也很结实漂亮 里面有说明书 保修单 充电器和线 还有透明壳 上手重量正好不轻不重 颜色无偏差淡淡的粉色很适合女性 手感极好 屏幕完全可以当镜子使用 设置简单方便 屏幕够大 适合爱追剧看电影的 拍照效果晚上还是可以的 白天应该也不错 毕竟后置双摄 前置像素也高 喜欢拍照的也适合 运行流畅 不玩手游所以无影响 就是实时耳返功能形同虚设 全民和唱吧都没效果 喜欢唱歌的还是加个声卡 还送了耳机 这个价位很值了,5,2018-07-09 21:26:38,琉***猬,粉色,4GB+64GB,标准版,来自京东Android客户端,金牌会员
22517,22517, 畅享8,京东送货速度真快，包装完好，手机大小重量适中，手感不错，运行速度尚可，毕竟千元机没有寄望太高。,5,2018-07-09 11:05:49,y***8,金色,4GB+64GB,标准版,来自京东Android客户端,钻石会员
22518,22518, 畅享8,用了两天，感觉没有我想像中的快，运行内存应该没有4G，这个价格就将就用吧，快递倒是得快！,5,2018-06-26 21:42:03,d***4,粉色,4GB+64GB,标准版,来自京东Android客户端,金牌会员
22519,22519, 畅享8,宝贝还可以，就是照片照出的没有同价位的好。,4,2018-07-23 13:41:15,钱***6,金色,4GB+64GB,标准版,来自京东Android客户端,银牌会员
22520,22520, 畅享8,手机刚拿回来打开看了挺好的，只是还没装卡！还没用呢我想应该不错，期待下次购买谢谢,5,2018-07-15 10:51:58,j***0,金色,4GB+64GB,标准版,来自京东Android客户端,铜牌会员
22521,22521, 畅享8,特意用了一段时间再评论，个人感觉玩游戏什么之类的都还好，但感觉电池没那么耐用,5,2018-08-02 12:01:52,s***i,蓝色,4GB+64GB,标准版,来自京东Android客户端,银牌会员
22522,22522, 畅享8,京东快递的物流很快，没的说，手机收到了，与心里预期效果一样，用段时间再看吧！,5,2018-07-27 10:54:42,大***3,蓝色,4GB+64GB,标准版,来自京东iPhone客户端,金牌会员
22523,22523, 畅享8,屏幕大，外观漂亮。中意的是他的CPU，真心是不错的，性价比不错。像素1300，前置800我也觉得够用。64g对我来说也足够。支持国货！另外虽然下午降价了，但是服务没话说。,5,2018-08-01 20:35:39,J***艾,金色,4GB+64GB,标准版,来自京东Android客户端,PLUS会员
22524,22524, 畅享8,还好吧，暂时没有什么太大的感觉，屏幕较大 还可以 运行有时稍卡，整体还可以 OK吧 比较耐心，发货速度可以。,5,2018-05-13 13:26:17,j***2,金色,3GB+32GB,标准版,来自京东Android客户端,PLUS会员
22525,22525, 畅享8,实际与介绍的一模一样，手机滑动流畅，手机的音质也十分好???,5,2018-07-25 15:43:43,j***q,金色,4GB+64GB,标准版,来自京东Android客户端,金牌会员
22526,22526, 畅享8,物流很快，颜色颜值很高，系统也很流畅，给麻麻买的，麻麻很满意,5,2018-07-30 17:41:32,三千红尘我为客,蓝色,4GB+64GB,标准版,来自京东Android客户端,金牌会员
22527,22527, 畅享8,这个很好用，质量好狠，喜欢，而且用着很舒心，就是很喜欢了，没有什么不好，一直在京东买东西，习惯了，速度，质量都不错的。为了来凑个字数，为了得个京豆，反正好了。就是有点厚，像素一般,5,2018-08-06 01:41:08,董***1,黑色,4GB+64GB,标准版,来自京东iPhone客户端,银牌会员
22528,22528, 畅享8,京东送货很快，态度很好，但是这个价格吗???,5,2018-08-02 00:15:02,k***年,金色,4GB+64GB,标准版,来自京东Android客户端,银牌会员
22529,22529, 畅享8,给老婆买的这款手机。挺好看，用起来很舒服，特别是照相功能，照出来的照片特别清晰。物流就不用说了，晚上9点多下订单，第二天上午就收到了。京东购物就是好。,5,2018-06-23 14:41:53,沉***本,金色,4GB+64GB,标准版,来自京东Android客户端,PLUS会员
22530,22530, 畅享8,买了四个了，被偷了好几个了，这个价位不错了！,5,2018-07-09 18:18:35,买***手,金色,4GB+64GB,标准版,来自京东Android客户端,金牌会员
22531,22531, 畅享8,手机外观简约大方，用后追评,5,2018-07-30 19:57:00,j***r,金色,4GB+64GB,标准版,来自微信购物,银牌会员
22532,22532, 畅享8,"手机真的很不错，运行很流畅，查了一下识别码应该是正品。屏幕边框是白色的，背面是金色，不是很协调，过这款手机真的是美观大方。外包装也很讲究，还送了一个硅胶软壳，谢谢！
接下来说最重要的，充电器！充电真的很慢很慢，得两个多小时，我都怀疑这不是原装充电器。以前用的HUAWEI荣耀8，不到一个半小时就能充满，对这个充电器严重怀疑！！！",4,2018-07-27 09:45:17,天***人,金色,4GB+64GB,标准版,来自京东Android客户端,PLUS会员
22533,22533, 畅享8,今天刚收到，用着不错，,5,2018-07-23 19:15:40,j***i,黑色,4GB+64GB,标准版,来自京东Android客户端,银牌会员
22534,22534, 畅享8,此用户未填写评价内容,5,2018-07-31 11:18:08,j***4,金色,4GB+64GB,标准版,来自京东Android客户端,银牌会员
22535,22535, 畅享8,非常喜欢非常满意。是给妈妈买的。她还选了个粉色。呵呵。果然是很漂亮的手机。以后继续关注这款。一直是用华为的手机。真心不错。赞??赞赞赞赞赞,5,2018-07-12 20:57:49,j***4,粉色,4GB+64GB,标准版,来自京东Android客户端,金牌会员
22536,22536, 畅享8,给妈妈买的妈妈看了蛮喜欢的， 性价比也不错 他们用这款比较合适，我看有的网友评论也是给妈妈买的 看了一下确实不错。京东物流员服务态度也好！,5,2018-07-24 13:54:25,暧***e,粉色,4GB+64GB,标准版,来自京东Android客户端,金牌会员
22537,22537, 畅享8,买给妈妈的，很轻，像素一般，买贵了，后来退了差价，返了京东。,5,2018-07-05 20:10:20,j***c,金色,3GB+32GB,标准版,来自京东Android客户端,PLUS会员
22538,22538, 畅享8,给家人买的手机，送给她，玩玩，让她体验一下新手机，给我京豆呀。一定要好好体验一下。,5,2018-05-01 16:09:00,A***7,金色,3GB+32GB,标准版,来自京东Android客户端,金牌会员
22539,22539, 畅享8,手机外观漂亮，京东物流放心有保证，而且速度快，收到的是全新包装未拆封。用了段时间了，系统流畅，屏幕清晰，挺不错的,5,2018-07-20 11:30:38,j***8,金色,4GB+64GB,标准版,来自京东Android客户端,PLUS会员
22540,22540, 畅享8,快递已经收到了，京东很给力，都是第二天准时送达，很满意，东西打开看了，没啥大问题，好不好就看以后了。。。,5,2018-08-01 23:37:52,梅***你,蓝色,4GB+64GB,标准版,来自京东Android客户端,PLUS会员
22541,22541, 畅享8,手机手感很好，快递小哥服务态度棒，这是第四次买手机了，不错?,5,2018-08-08 11:44:58,j***y,金色,3GB+32GB,标准版,来自京东iPhone客户端,金牌会员
22542,22542, 畅享8,"华为手机，老公的最爱，每次换手机就是这个牌子，用了好几个了，这是华为第一次带耳机的手机！
价格适中，老百姓的经济适用性，必须好评，",5,2018-06-27 00:13:05,美***场,金色,4GB+64GB,标准版,来自京东Android客户端,钻石会员
22543,22543, 畅享8,非常好，支持华为，物美价廉。中华有所作为。,5,2018-08-05 16:35:08,文***5,金色,3GB+32GB,标准版,来自京东Android客户端,PLUS会员
22544,22544, 畅享8,东西收到了，京东物流还是非常快了，手机大小，速度都不错了，最主要看中了三个卡槽结构，可以多卡及再次拓展内存。手机速度也挺快的,5,2018-07-19 21:11:41,a***f,蓝色,4GB+64GB,标准版,来自京东Android客户端,金牌会员
22545,22545, 畅享8,屏幕很大，不到六寸，握持感超级好！送货及时，配送员也非常的热情，有时候不方便收件的时候，也安排时间另行配送。同时京东商城在售后管理上也非常好以解客户忧患，排除万难。给予我们非常好的购物的体验。质量非常好，与卖家描述的完全一致，非常满意，真的完全超出期望值，发货速度非常快，包装非常仔细、严实，物流公司服务态度很好，运送速度也很快。祝生意兴隆商品大卖！,5,2018-08-03 21:20:33,月***尼,黑色,3GB+32GB,标准版,来自京东Android客户端,PLUS会员
22546,22546, 畅享8,给老人家买的，以前买的华为手机都是有贴出厂膜，很奇怪这次没有贴，造成了不必要的麻烦〈很不人性化〉，品控有下降，手机边框有局部有一处带点毛刺，千元机的做工和旗舰机差距明显，2018年了新机还是用的430，居然没用华为自己的6系，很遗憾，充电口还是老接口不是c口，使用中可能会误操作，无快充，充电很慢。优点还是有屏幕大，机身比较轻，有面部识别功能，这点还是很方便老人家使用，要不是老人家指定喜欢这款真不推荐购买，就这么多，仅供参考。,4,2018-07-08 18:31:25,李***9,蓝色,4GB+64GB,标准版,来自京东Android客户端,PLUS会员
22547,22547, 畅享8,买给妈妈用的，还不错，屏幕够大，反应也还可以，老人用足够了。,5,2018-08-01 10:31:01,董***7,金色,3GB+32GB,标准版,来自京东Android客户端,金牌会员
22548,22548, 畅享8,速度还可以4G的总比3G的强一些，挺好的，给家里老人买的，屏幕发大小合适，使用也简单，家人很满意。还送了个耳机，也不错～,5,2018-07-09 22:34:16,苏***3,金色,4GB+64GB,标准版,来自京东Android客户端,钻石会员
22549,22549, 畅享8,一直在京东买东西，相信京东。比实体店便宜。东西也正。物流很快，手机颜色很好看，用起来也还可以。挺流畅的，手感也很不错,5,2018-07-25 14:34:25,j***t,蓝色,4GB+64GB,标准版,来自京东iPhone客户端,钻石会员
22550,22550, 畅享8,价格实惠，质量不错，性价比高，发货速度快，品牌值得信赖！,5,2018-07-23 21:18:27,h***3,金色,3GB+32GB,标准版,来自京东iPhone客户端,企业会员
22551,22551, 畅享8,618大促销真的便宜，手机性能杠杠的，客服服务态度很好，物流速度给力，性价比超高的一款手机，好评！,5,2018-06-28 04:49:06,人***停,蓝色,4GB+64GB,标准版,来自京东Android客户端,PLUS会员
22552,22552, 畅享8,配送很快，包装也不错，没有赠品有点可惜，手机壳并不能很好地装手机，并且手机壳挖的孔特别大，装在手机上孔是斜的，不造为啥手机标签也是斜着贴的。手机比想象中的大，用一段时间再评论吧,4,2018-04-30 16:08:36,本***T,粉色,4GB+64GB,标准版,来自京东Android客户端,铜牌会员
22553,22553, 畅享8,早上拍的下午就送到了，物流超快！，包装完好，信赖华为，已经在京东买了三个华为手机了，很满意！,5,2018-07-06 13:00:42,槐***1,金色,4GB+64GB,标准版,来自京东Android客户端,PLUS会员
22554,22554, 畅享8,外观时尚大气运行速度很快相信国产华为这是第三个华为手机了相信华为还会越来越好支持华为支持京东,5,2018-03-31 14:39:10,段博菲,黑色,4GB+64GB,标准版,来自京东Android客户端,金牌会员
22555,22555, 畅享8,手机颜色很漂亮，女儿非常喜欢！一直信赖京东！至于使用情况后续再追加！京东快递师傅送货速度快，服务态度很好！,5,2018-07-08 13:10:24,j***v,粉色,4GB+64GB,标准版,来自京东Android客户端,金牌会员
22556,22556, 畅享8,此用户未填写评价内容,5,2018-08-05 14:27:30,t***9,金色,3GB+32GB,标准版,来自京东Android客户端,金牌会员
22557,22557, 畅享8,给妹妹买的（我一大老爷们都觉得好看?）先说下物流，很给力哎，现在京东物流越来越好用了。下午收到后打电话说很不错，挺好用的。华为大牌子，不会错。?（只前给买了俩魅族，她都给弄丢了，这次换一个牌子，但愿别再丢了??）,5,2018-06-02 21:14:34,s***苍,粉色,4GB+64GB,标准版,来自京东Android客户端,银牌会员
22558,22558, 畅享8,屏幕大，颜值高，性能也不错，值得拥有！,5,2018-08-08 17:13:44,叶***7,金色,3GB+32GB,标准版,来自京东Android客户端,金牌会员
22559,22559, 畅享8,屏幕清晰屏幕大，速度也快，买给老人家用足够了。,5,2018-04-08 23:13:05,A***e,金色,3GB+32GB,标准版,来自京东Android客户端,PLUS会员
22560,22560, 畅享8,给老妈换的手机，之前已经用了三年的乐视手机，其实也不错，现在全家都是华为手机了,5,2018-07-29 18:49:44,林***睿,蓝色,4GB+64GB,标准版,来自京东Android客户端,PLUS会员
22561,22561, 畅享8,说实在的，送货速度快，应该是正品。但是运行速度怎么感觉还不如上一个2G+16G的华为，用作再看看。,5,2018-07-24 09:20:04,灰***娘,金色,4GB+64GB,标准版,,金牌会员
22562,22562, 畅享8,晚上9点下单，第二天早上9点就收到了，惊喜@的。试过了，质量很好，而且功能稳定。以后还要买华为！,5,2018-07-05 13:19:27,j***v,黑色,3GB+32GB,标准版,来自京东iPhone客户端,银牌会员
22563,22563, 畅享8,支持华为，这款就是有点厚,5,2018-08-25 14:32:11,x***n,金色,3GB+32GB,标准版,来自京东Android客户端,钻石会员
22564,22564, 畅享8,这个手机真的很不错，是买给长辈用的，屏幕很大，而且现在华为的配置也超乎了我的想象我，这么便宜就有这么好的配置，我认为很好了。第二就是粉红色的表面很好看，背面就一般般了，这一款好像是背后塑料的。总之真的很赞很便宜。,5,2018-06-29 10:55:37,虾饺妹儿,粉色,3GB+32GB,标准版,来自京东iPhone客户端,银牌会员
22565,22565, 畅享8,"手机外观不错，但是不支持华为钱包，我问过华为客服了。公交卡也是需要下载各自地方的软件，然后再emememem，总之没用起，不能刷，这么麻烦，我用（只服包）的卡劵直接刷就行，还搞得这么麻烦。
毕竟是国产，支持一下吧。实在没优点，只有这样写了。
另外拍照咋个拍，我就一个手机，只有对着镜子拍了。

朋友们，一定要擦亮双眼啊，，，，",5,2018-07-02 21:30:18,j***6,金色,3GB+32GB,全网通NFC版,来自京东Android客户端,金牌会员
22566,22566, 畅享8,宝贝不错，买给妈妈，妈妈很喜欢，手机很好看。配置什么的都很不错，一家人都很喜欢华为的手机，支持国产,5,2018-06-26 19:42:37,1***燕,蓝色,4GB+64GB,标准版,来自京东Android客户端,金牌会员
22567,22567, 畅享8,包装完好无损，手机特别漂亮，价格实惠，京东快递特别快，很愉快的一次网购，值得信赖，好评。,5,2018-08-05 21:49:45,j***1,金色,4GB+64GB,标准版,来自京东Android客户端,金牌会员
22568,22568, 畅享8,非常好，屏幕还大，一直特别喜欢京东，一次性在京东买了两款华为手机,5,2018-07-09 11:43:55,1***p,黑色,4GB+64GB,标准版,来自京东iPhone客户端,PLUS会员
22569,22569, 畅享8,包装完好，手机质量也很好，快递小哥的速度很快，服务很热情。,5,2018-07-19 07:04:08,紫***雪,金色,4GB+64GB,标准版,来自京东Android客户端,金牌会员
22570,22570, 畅享8,支持京东产品，质量好，有保障，感谢京东给予我们这么好的平台,5,2018-07-06 17:43:57,久***i,黑色,4GB+64GB,标准版,来自京东Android客户端,PLUS会员
22571,22571, 畅享8,手机是原封出厂设置，里面配了个透明外壳，比较轻薄，,5,2018-07-23 18:04:18,b***l,金色,4GB+64GB,标准版,来自京东iPhone客户端,PLUS会员
22572,22572, 畅享8,给老爸买的，外观设计好看，很薄！屏幕挺大，拍照效果好！,5,2018-06-22 21:30:26,彦***贝,蓝色,4GB+64GB,标准版,来自京东Android客户端,PLUS会员
22573,22573, 畅享8,发货挺快的，华为的手机目前做的是真不错。?,5,2018-08-05 17:17:48,j***2,蓝色,4GB+64GB,标准版,来自京东iPhone客户端,PLUS会员
22574,22574, 畅享8,好生气啊，竟然掉到1100元郁闷郁闷！亏大了,5,2018-08-03 17:18:58,m***g,金色,4GB+64GB,标准版,来自京东iPhone客户端,PLUS会员
22575,22575, 畅享8,"手机很好，就是电池有点小，还不支持快充。
看图片有时会不正常，看下图",5,2018-07-04 18:13:25,j***1,黑色,4GB+64GB,标准版,来自京东Android客户端,银牌会员
22576,22576, 畅享8,这个价格买到这款手机算是性价比很高了，外观很漂亮，手机轻薄，屏幕够大够清晰，人脸识别很灵敏，重点是物流很快，对于客户诉求还是积极重视的。使用效果后续追评，目前还不错。,5,2018-07-13 22:25:41,n***g,金色,4GB+64GB,标准版,来自京东Android客户端,PLUS会员
22577,22577, 畅享8,给先生买的，他用了有一个多月了吧！总体还行，日常使用可以，他不打游戏，还送了一个耳机，屏幕也很大，这款金的颜色也很不错，先生喜欢，这个价位算不错的了，运送速度快，包装完好，无破损！满意！,5,2018-07-19 10:08:25,j***6,金色,4GB+64GB,标准版,来自京东Android客户端,银牌会员
22578,22578, 畅享8,不错，屏幕大，运行流畅，电池续航耐用，挺好用的，华为不愧是民族品牌。,5,2018-06-24 10:29:26,适***好,黑色,4GB+64GB,标准版,来自京东Android客户端,PLUS会员
22579,22579, 畅享8,非常好，给父母买着平时用，就是送的线，端口不对,5,2018-07-05 10:41:38,善***啊,金色,4GB+64GB,标准版,来自京东iPhone客户端,PLUS会员
22580,22580, 畅享8,手机高大上，华为国产一点也不输给美产苹果，现在全家齐换华为手机啦,5,2018-07-14 12:22:55,s***林,粉色,4GB+64GB,标准版,来自京东Android客户端,钻石会员
22581,22581, 畅享8,收到了，上午下单，下午到货。运行速度很快。,5,2018-07-26 20:26:32,山***水,黑色,4GB+64GB,标准版,来自京东Android客户端,PLUS会员
22582,22582, 畅享8,手机很好看，显得特别高大上，非常喜欢，反应速度快，快递也很给力,5,2018-07-11 07:33:39,侧***Z,黑色,4GB+64GB,标准版,来自京东iPhone客户端,银牌会员
22583,22583, 畅享8,999买的，这个价格还是很划算的，很满意，京东的老顾客了，送货人员特别客气，点个赞，买了两箱了，不错的，好好好,5,2018-09-07 16:13:39,小***G,金色,3GB+32GB,标准版,来自京东Android客户端,钻石会员
22584,22584, 畅享8,不错的手机，比原来的快了不少，目前挺好,5,2018-07-02 16:29:31,j***2,金色,4GB+64GB,标准版,来自京东Android客户端,PLUS会员
22585,22585, 畅享8,送给老妈的，屏幕大，分辨率也可以，各种功能齐全，推荐购买。,5,2018-06-28 23:36:31,j***x,粉色,4GB+64GB,标准版,来自京东iPhone客户端,金牌会员
22586,22586, 畅享8,商品给力，外观漂亮，物流超快，好评。,5,2018-07-09 12:46:40,j***i,粉色,4GB+64GB,标准版,来自京东Android客户端,PLUS会员
22587,22587, 畅享8,手机刚到，还可以，用过之后追加评论，期待会好用，倍赖华为,5,2018-07-08 17:21:27,j***0,蓝色,4GB+64GB,标准版,来自京东Android客户端,铜牌会员
22588,22588, 畅享8,很轻，屏幕很大，给我爸买的，好的话以后还会买这个牌子,5,2018-08-05 15:49:14,微***忆,金色,4GB+64GB,标准版,来自京东Android客户端,银牌会员
22589,22589, 畅享8,不错，手感好，有待进一步体验性能,5,2018-07-14 16:38:08,z***1,蓝色,3GB+32GB,全网通NFC版,来自京东iPhone客户端,PLUS会员
22590,22590, 畅享8,手机不错买两个了，反应很快，,5,2018-05-18 22:07:25,j***0,黑色,3GB+32GB,标准版,来自京东iPhone客户端,PLUS会员
22591,22591, 畅享8,非常棒的手机，快递员很给力送的也快，手机很不错,5,2018-07-30 16:25:35,s***l,蓝色,3GB+32GB,标准版,来自京东Android客户端,金牌会员
22592,22592, 畅享8,父亲节给老爸换了华为手机，比较了几款，觉得畅享8最合适，屏幕够大，分辨率也不用特别高，标配就足够啦，虽然没有mate系列速度快，一般使用完全没问题啊,5,2018-06-22 19:06:36,k***g,黑色,3GB+32GB,标准版,来自京东Android客户端,PLUS会员
22593,22593, 畅享8,很不错,5,2018-08-01 12:01:00,j***d,黑色,4GB+64GB,标准版,来自京东Android客户端,银牌会员
22594,22594, 畅享8,此用户未填写评价内容,5,2018-07-29 18:03:39,哈***哈,蓝色,4GB+64GB,标准版,来自京东Android客户端,PLUS会员
22595,22595, 畅享8,快递速度快，东西已收到。用了下网速还可以,5,2018-07-20 09:40:57,j***w,金色,4GB+64GB,标准版,来自京东Android客户端,银牌会员
22596,22596, 畅享8,一直用华为，东西没的说，国产龙头，强?,5,2018-07-17 12:54:59,入***夜,金色,3GB+32GB,全网通NFC版,来自京东Android客户端,钻石会员
22597,22597, 畅享8,还不错，送了耳机，人脸识别也比较方便。,5,2018-07-23 10:24:54,I***H,粉色,4GB+64GB,标准版,来自京东Android客户端,金牌会员
22598,22598, 畅享8,质量不错，给爸爸买的，他很喜欢，用起来还不错。京东购物，质量有保障，方便快捷,5,2018-08-02 14:33:58,月***话,金色,3GB+32GB,标准版,,PLUS会员
22599,22599, 畅享8,华为品牌的手机我们一家人都在用，华为是令我们非常骄傲的国产品牌，是值得信奈的品牌，非常好用，一直追随，华为加油。谢谢快递小哥的服务，辛苦了！,5,2018-07-16 20:21:23,玉***6,金色,4GB+64GB,标准版,,PLUS会员
22600,22600, 畅享8,手感非常的舒适，外观漂亮，大气，系统流畅,5,2018-06-29 20:35:06,1***8,金色,4GB+64GB,标准版,来自京东Android客户端,钻石会员
22601,22601, 畅享8,都好，都好，爱不释手。喜欢，喜欢。,5,2018-08-05 15:52:38,j***c,黑色,4GB+64GB,标准版,来自京东Android客户端,金牌会员
22602,22602, 畅享8,货已收到了，试用之中，稍后评价一下,5,2018-07-01 19:08:14,j***6,金色,4GB+64GB,标准版,来自京东Android客户端,钻石会员
22603,22603, 畅享8,整体还行.机身比较轻.就是稍微大了一点.性能感觉一般吧.只是附号用下.,5,2018-07-27 23:41:36,1***2,金色,3GB+32GB,标准版,来自京东iPhone客户端,PLUS会员
22604,22604, 畅享8,送给老婆的，她很喜欢，很好,5,2018-07-20 22:25:34,j***d,金色,4GB+64GB,标准版,来自京东Android客户端,金牌会员
22605,22605, 畅享8,这是第二次买了质量ok,5,2018-08-05 19:38:00,j***i,粉色,4GB+64GB,标准版,来自京东Android客户端,银牌会员
22606,22606, 畅享8,手机很漂亮，卖给妈妈的，她很喜欢,5,2018-07-23 20:05:51,j***t,粉色,4GB+64GB,标准版,来自京东Android客户端,铜牌会员
22607,22607, 畅享8,物流超快，手机性价比超高，功能齐全！,5,2018-06-23 16:54:20,俊***o,金色,4GB+64GB,标准版,来自京东iPhone客户端,金牌会员
22608,22608, 畅享8,昨天下单，今天到手了，超快的。大爱！太好看了，支持华为手机，支持国货。马上进行操作了，验证了真伪，是正品，千元手机值了。为京东、快递小哥点赞。,5,2018-08-04 15:29:39,whenZcuyLBKE,金色,4GB+64GB,标准版,来自微信购物,银牌会员
